article_id,prod_name,product_type_name,product_group_name,colour_group_name,detail_desc
707109001,Chris 3pk Occasional,Underwear bottom,Underwear,Red,Trunks in stretch cotton jersey with flatlock seams, an elasticated waist, lined front and mid-length legs.
707135012,Vivi boatneck,Sweater,Garment Upper body,Off White,Jumper in a fine-knit viscose blend with a boat neck and 3/4-length sleeves.
707155008,KARIN+,Bra,Underwear,Black,Sports bra in fast-drying functional fabric with a lined front, racer back with sections in ventilating mesh and a wide elastic hem. Medium support.
707246001,Rick velvet,Cap/peaked,Accessories,Black,Cap in velour with an adjustable fastener at the back. Mesh lining.
707274001,OL HARDING PQ loafer,Flat shoe,Shoes,White,Suede loafers with soft heel caps and a loop at the back. Fabric linings, leather insoles and thermoplastic rubber soles.
707307001,Lagunamoon,Top,Garment Upper body,White,Long-sleeved jumper in a rib knit with a V-neck and sewn-in wrapover at the top.
707324002,N Agnes knitted sweater,Sweater,Garment Upper body,Blue,Jumper in a soft, fine knit with 3/4-length sleeves and ribbed cuffs. High slits with a decorative button at the sides for easier nursing access.
707353001,Logg Cozy wrap,Sweater,Garment Upper body,Light Beige,Jumper in a soft, fine knit with a V-neck, sewn-in wrapover at the front and long sleeves.
707470001,Andy chichago mould,Bra,Underwear,White,Non-wired, lace push-up bra with moulded, padded cups for a larger bust and fuller cleavage. Adjustable shoulder straps and a narrow hook-and-eye fastening at the back.
707704005,Shake it in Tie Brief,Swimwear bottom,Swimwear,Light Orange,Fully lined bikini bottoms with a low waist, wide ties at the sides and medium coverage at the back.
708021001,PINKY Loose Fitted Tank,Vest top,Garment Upper body,Black,Loose-fitting sports vest top in fast-drying jersey with a racer back.
708085001,Ramona body,Top,Garment Upper body,Black,V-neck, fitted body in ribbed jersey with lace details, narrow shoulder straps and press-studs at the crotch.
708230002,LINNI TEE,T-shirt,Garment Upper body,White,T-shirt in soft cotton jersey with sewn-in turn-ups on the sleeves.
708285002,Fleet price hood,Hoodie,Garment Upper body,Dark Orange,Top in soft, printed sweatshirt fabric with a wrapover, jersey-lined hood, long sleeves and ribbing at the cuffs. Soft brushed inside.
708311017,vermont fancy slacks (1),Trousers,Garment Lower body,Beige,Ankle-length trousers in woven fabric with creases, a regular waist, hook-and-eye fastener and zip fly. Diagonal side pockets and fake welt back pockets.
708336001,BIRD TEE,T-shirt,Garment Upper body,Black,Short, fitted jersey top with short sleeves, a visible seam down the front and an asymmetric hem. Slightly shorter front with a draped detail at the hem.
708380002,Mikaela,Top,Garment Upper body,Black,Sleeveless top in soft jersey containing some linen with a small, pleated lace trim around the armholes and gathers in the sides for best fit.
708430007,MC Murphy dress,Dress,Garment Full body,Light Pink,Long dress in viscose jersey with a lace bodice. Wide neckline with a V-neck at the back, short cap sleeves and a concealed zip at the back.
708432001,Chaka linnen,Top,Garment Upper body,Black,Top in airy linen jersey with short flounced sleeves and a deep V-neck with buttons at the top.
708443003,ESPRESSO SS,T-shirt,Garment Upper body,Light Beige,Short, off-the-shoulder top in crinkled jersey with short puff sleeves and elastication with a small frill trim around the top, sleeves and hem.
708492003,Leona long dress,Dress,Garment Full body,Light Red,Wide, sleeveless dress in softly draping jersey. Unlined.
708609003,MALOU shorts,Shorts,Garment Lower body,White,Puff pants in a cotton weave with elastication and a frill trim at the waist and elasticated hems.
708626001,Freddie sneaker,Sneakers,Shoes,Light Pink,Trainers in imitation suede with lacing at the front, fabric linings and insoles and ethylene-vinyl acetate (EVA) soles.
708677001,LNY ZHENG SWEATER,Sweater,Garment Upper body,Beige,Short top in printed sweatshirt fabric made from a cotton blend. Stand-up collar, zip at the top, long sleeves with stripes in a contrasting colour and wide elastication at the cuffs. Soft brushed inside.
708688001,AK SODIUM SKIRT D1,Skirt,Garment Lower body,Light Blue,5-pocket, knee-length skirt in washed denim with a high waist, zip fly and slit at the front of the hem.
708993004,Jasmine,Dress,Garment Full body,Red,Short dress in a patterned weave with a round neckline and an opening with a concealed button at the back of the neck. Long sleeves with an opening and button at the cuffs, and a detachable tie belt at the waist. Partly lined.
709173001,Alabama,Boots,Shoes,Black,Imitation suede ankle boots with a zip in one side and a decorative strap with a metal buckle. Satin linings, imitation leather insoles and thermoplastic rubber (TPR) soles. Heel 9 cm.
709346001,Cool Penny Grip phone case,Other accessories,Accessories,Gold,Smartphone case in transparent plastic with metallic-coloured trims and a smartphone ring with a disc that can be rotated by 360°. Fits iPhones 6-8.
709466005,CHANNING L/S,T-shirt,Garment Upper body,Dark Blue,Striped top in soft organic cotton jersey with a round neck and long sleeves.
709755002,Skinny Carrot 5pkt,Trousers,Garment Lower body,Blue,5-pocket jeans in washed, stretch denim with worn details, a regular waist, button fly, lower crotch and skinny, tapered legs. The jeans are made partly from recycled cotton.
710087002,Pilot Thong Mic 3p,Underwear bottom,Underwear,Light Pink,Thong briefs in microfibre with lace sections, a low waist, lined gusset, narrow sides and string back.
710328002,OL CHARLEE PQ slip-in,Flat shoe,Shoes,Black,
710426010,PEACH solid single tee,T-shirt,Garment Upper body,Light Yellow,T-shirt in organic cotton jersey with a rounded hem.
710695001,PAM CANVAS CAP,Cap/peaked,Accessories,Light Pink,Cap in cotton twill with an adjustable metal fastening at the back.
710876031,Kennedy skinny chinos,Trousers,Garment Lower body,Dark Beige,Chinos in stretch cotton twill with a zip fly and button, diagonal side pockets and welt back pockets with a button. Skinny Fit – a fit with slightly shorter legs that is close-fitting at the thighs, knees and ankles to create a completely fitted silhouette.
710931001,Larsson well dressed set,Garment Set,Garment Full body,Light Blue,Set with a shirt in a cotton weave, bow tie, and a pair of trousers woven in a linen blend. Shirt with a collar, buttons down the front and long sleeves with narrow, buttoned cuffs. Bow tie with an adjustable elastic strap and plastic fastener at the back. Trousers with an adjustable, elasticated waist, fake fly with fasteners and detachable braces.
710936002,HEDDA 3p tank(1),Vest top,Garment Upper body,White,Vest tops in organic cotton jersey with narrow shoulder straps.
711048006,RACHEL Dress,Dress,Garment Full body,Greenish Khaki,Dress in soft, organic cotton jersey with an elasticated drawstring waist and short sleeves.
711074008,Tom cargo shorts,Shorts,Garment Lower body,Yellowish Brown,Shorts in washed cotton with an adjustable, elasticated waist and a zip fly and button. Side pockets, leg pockets and fake welt back pockets with a flap and hook and loop fastening.
711155006,Diana price,Sweater,Garment Upper body,Light Grey,Top in soft sweatshirt fabric with a round neck, print motif, long sleeves and ribbing around the neckline, cuffs and hem.
711235026,2P LS PJ with zip,Pyjama jumpsuit/playsuit,Nightwear,Dark Blue,All-in-one pyjamas in soft organic cotton jersey with a zip down the front that continues down one leg and has a chin guard at the top. Ribbing around the neckline, cuffs and hem.
711280006,Anders SS shirt,Shirt,Garment Upper body,White,Shirt in a cotton weave with a collar, buttons down the front and chest pocket. Yoke at the back, short sleeves with sewn-in turn-ups, and a rounded hem.
711288001,Papaya,Blouse,Garment Upper body,White,Blouse in a crêpe weave with a V-shaped opening at the top and collar with ties at the front. Long sleeves and wide cuffs with slits and buttons. Lined at the front.
711407002,H-band Denim (1),Hair/alice band,Accessories,Light Pink,Hairband in a soft weave with a bow at the front and covered elastic at the back.
711465018,DIV Rivera dress,Dress,Garment Full body,Black,Short dress in a viscose weave with lace trims. V-neck opening at the top, a round neckline with twisted ties and 3/4-length balloon sleeves with narrow cuffs. Unlined.
711582004,Kendall bikerpant,Leggings/Tights,Garment Lower body,Dark Beige,Cycling shorts in soft cotton jersey with an elasticated waist.
711582009,Kendall bikerpant,Leggings/Tights,Garment Lower body,Beige,Cycling shorts in soft cotton jersey with an elasticated waist.
711582010,Kendall bikerpant,Leggings/Tights,Garment Lower body,White,Cycling shorts in soft cotton jersey with an elasticated waist.
711685008,Charlotte Pull On Soft Bra,Bra,Underwear,Light Pink,Non-wired lace bra with moulded cups that give the bust a natural shape and provide light support. Narrow, adjustable shoulder straps and a wide lace trim at the hem. No fasteners.
712056003,CHARLIE dungaree,Dungarees,Garment Full body,Light Beige,Baby Exclusive. Dungarees in sturdy organic cotton jersey with elastication at the back of the waist and straps with adjustable buttoning. Concealed press-studs at the crotch (except in sizes 1-4Y) and sewn-in turn-ups at the hems.
712104001,MIA 2p joggers,Trousers,Garment Lower body,Light Pink,Joggers in soft sweatshirt fabric with an elasticated drawstring waist, side pockets and ribbed hems. Soft brushed inside.
712143001,Tywin sneaker PQ,Sneakers,Shoes,Black,Suede trainers with lacing, a lightly padded edge and tongue, mesh linings and insoles and thermoplastic (TPR) rubber soles.
712231001,Pila Blouse,Blouse,Garment Upper body,Black,Blouse in an airy weave with a deep V-neck, decorative buttons down the front, long puff sleeves and cuffs with a covered button. Seam at the waist that is elasticated at the back, and a gently flared peplum.
712320002,Humble Top,Vest top,Garment Upper body,Light Orange,V-neck top in satin with lace trims, a sewn-in wrapover at the front and adjustable spaghetti shoulder straps. Narrow elasticated seam at the waist and a gentle flare to the hem.
712320003,Humble Top,Vest top,Garment Upper body,Off White,V-neck top in satin with lace trims, a sewn-in wrapover at the front and adjustable spaghetti shoulder straps. Narrow elasticated seam at the waist and a gentle flare to the hem.
712351001,Speed primer necklace,Necklace,Accessories,Black,Short grosgrain necklace with plastic pendants with faceted beads in glass and plastic. Fastens with ties at the back. Total length approx. 98 cm.
712406005,Sandy HW wide full,Trousers,Garment Lower body,Dark Grey,Trousers in woven fabric with a high waist, hook-and-eye fasteners and zip fly. Side pockets and straight, wide legs.
712427001,H-band flower Helena,Hair/alice band,Accessories,Other Pink,Elastic hairband with flower appliqués.
712801004,Miles s/s price tee,T-shirt,Garment Upper body,White,T-shirt in soft cotton jersey with a print motif on the front.
712838005,Nira tee,T-shirt,Garment Upper body,White,T-shirt in slub cotton jersey with a wide neckline and tie detail at the front.
712846004,Bounty,Dress,Garment Full body,Black,Ankle-length dress in a soft weave with a V-neck, concealed buttons down the front and a detachable tie belt. Short, wide sleeves with sewn-in turn-ups and pleats at the front for extra width. Unlined.
712915001,SPEED Frosty dress,Dress,Garment Full body,Dark Blue,Short, sleeveless dress in lace with a round neckline, concealed zip at the back, seam at the waist and scalloped hem. Jersey lining.
712915006,SPEED Frosty dress,Dress,Garment Full body,White,Short, sleeveless dress in lace with a round neckline, concealed zip at the back, seam at the waist and scalloped hem. Jersey lining.
713199006,Lazer Razer Super Push,Bikini top,Swimwear,Black,Fully lined, super push-up balconette bikini top with underwired, thickly padded cups to maximise the bust and create a fuller cleavage. Detachable, adjustable shoulder straps and a metal fastener at the back.
713272001,Class GP Petra Stud Pk,Earring,Accessories,Gold,A pair of hoop earrings and a pair of round stud earrings in gold-plated metal. Diameter of studs approx. 0.5 cm, Diameter of hoops approx. 2.8 cm.
713336002,LOGG Ivy linen shorts,Trousers,Garment Lower body,Dark Blue,Shorts woven in a linen blend with an elasticated drawstring waist, side pockets, two fake back pockets and short slits in the hems.
713378001,Karl,Sweater,Garment Upper body,Beige,Oversized jumper in a jacquard knit containing some wool with ribbing around the neckline, cuffs and hem.
713577002,Malte r-neck,Sweater,Garment Upper body,Dark Blue,Jumper in soft, patterned, fine-knit cotton with ribbing around the neckline, cuffs and hem.
713743001,R-neck Allington 2-pack,T-shirt,Garment Upper body,White,Two T-shirts in premium cotton jersey.
713774048,Sixten boxer BB TP 3-p,Underwear bottom,Underwear,Light Yellow,Boxer shorts in organic cotton jersey with short legs, an elasticated waist and lined front.
713774049,Sixten boxer BB TP 3-p,Underwear bottom,Underwear,Black,Boxer shorts in organic cotton jersey with short legs, an elasticated waist and lined front.
713774058,Sixten boxer BB TP 3-p,Underwear bottom,Underwear,Other Pink,Boxer shorts in organic cotton jersey with short legs, an elasticated waist and lined front.
713774060,Sixten boxer BB TP 3-p,Underwear bottom,Underwear,Red,Boxer shorts in organic cotton jersey with short legs, an elasticated waist and lined front.
713850004,Chris crepe shoe,Other shoe,Shoes,Black,Derby shoes in imitation suede with pointed toes and open lacing. Canvas linings and insoles and thermoplastic rubber (TPR) soles. Heel approx. 2.5 cm. The shoes are made partly from recycled polyester.
713986003,Manson slim blazer,Blazer,Garment Upper body,Grey,Single-breasted jacket in a stretch weave with narrow notch lapels with a decorative buttonhole, a chest pocket, flap front pockets and one inner pocket. Two buttons at the front, decorative buttons at the cuffs and a single back vent. Lined. Slim fit that tapers at the chest and waist which, combined with slightly narrower sleeves, creates a fitted silhouette.
714026013,Manson slim fit trs,Trousers,Garment Lower body,Dark Grey,Suit trousers in woven fabric with a concealed hook-and-eye fastening and zip fly. Side pockets, jetted back pockets and legs with creases. Slim Fit – a fit that is close-fitting at the thighs, knees and ankles to create a fitted silhouette.
714033001,Matt reg elastic crop trs,Trousers,Garment Lower body,Black,Suit trousers in woven fabric with a concealed hook-and-eye fastener and zip fly. Diagonal side pockets, jetted back pockets and legs with creases. Regular fit – a classic fit with good room for movement over the thighs and knees to create a comfortable, straight silhouette.
714083005,SB PRICE TRUNKS,Swimwear bottom,Swimwear,Dark Blue,Swimming trunks with an elasticated drawstring waist.
714084003,Lovisa heart,Bag,Accessories,Black,Heart-shaped bag in imitation patent leather and imitation suede with a zip and shoulder strap at the top. Lined. Size 4x17 cm.
714190001,Ladybug dress,Dress,Garment Full body,Black,Calf-length, fitted, off-the-shoulder dress in a rib knit with cap sleeves.
714340002,Basic LS Roll up t-shirt,T-shirt,Garment Upper body,Dark Blue,Top in organic cotton jersey with press-studs on one shoulder and long sleeves with a tab and button.
714343003,ELLINOR NG,Night gown,Nightwear,White,Nightdress in soft, patterned cotton jersey with short, elasticated raglan sleeves and an elasticated neckline.
714345007,Falun soft shirt,Shirt,Garment Upper body,Dark Blue,Short-sleeved shirt in a cotton weave with a narrow collar, buttons down the front and yoke at the back. Cap sleeves and a rounded hem.
714414001,RR 27.1 Blouse buttons,Blouse,Garment Upper body,Dark Blue,Short, wide blouse in an airy cotton weave with a stripe print, V-neck, buttons down the front, short sleeves and a rounded hem. Slightly longer at the back.
714419001,RR 27.6 Blouse Buttons,Blouse,Garment Upper body,White,Short-sleeved blouse in a crinkled viscose weave with a V-neck and buttons down the front.
714480001,GOTW A-band xmas mix,Hair/alice band,Accessories,Red,Satin-covered Alice band with appliqués on the top.
714620005,Tahiti shirt dress,Dress,Garment Full body,Yellowish Brown,Short dress in a patterned viscose weave with a collar and buttons down the front. Long sleeves with narrow elastication at the cuffs, a seam at the waist and a gently flared skirt. Unlined.
714650002,Pull On Ankle.,Trousers,Garment Lower body,Blue,Ankle-length trousers in airy denim. High, elasticated waist with pleats and ties, side pockets, fake back pockets and wide, straight legs.
714730007,Diana jumpsuit,Jumpsuit/Playsuit,Garment Full body,Turquoise,Chiffon playsuit with a V-neck, wrapover front with a concealed press-stud and an opening with a button at the back of the neck. Elasticated seam at the waist and long sleeves with flared flounces at the cuffs.
714828004,Evelyn midi dress,Dress,Garment Full body,Red,Calf-length dress in a crinkled weave with a V-neck, wrapover front with ties at the waist and short sleeves with a slit and ties. Unlined.
714872002,ED Onyx blouse,Blouse,Garment Upper body,Black,Blouse in a patterned viscose weave with an opening at the top with ties at the front, long sleeves with a gathered seam and wide, buttoned cuffs.
714885002,Olivia Dress,Dress,Garment Full body,Light Turquoise,Dress in a fine-knit cotton blend containing glittery threads with a decorative bow at the top, short sleeves and a gentle flare to the hem.
715024002,10 pk fancy,Socks,Socks & Tights,Dark Blue,Fine-knit socks in a cotton blend with elasticated tops.
715050004,Dilton peplum top,Blouse,Garment Upper body,Off White,Blouse in a patterned viscose weave with a square neckline and covered buttons down the front. Long, wide sleeves with elastication at the cuffs, and a seam and flounce at the hem. Lined.
715084004,Jay skinny blz,Blazer,Garment Upper body,Dark Blue,Single-breasted jacket in woven fabric with narrow notch lapels, a chest pocket, welt front pockets and two inner pockets. Fastening with one button at the front, a decorative button at the cuffs and a single back vent. Lined. Skinny Fit – a slightly shorter style that shapes in at the chest and tapers sharply at the waist. This combined with narrow shoulders and sleeves creates a completely fitted silhouette.
715138001,Filippa,Top,Garment Upper body,Black,Top in soft slub jersey made from a modal and cotton blend with a deep neckline and 3/4-length sleeves. Raw, roll edges around the neckline and cuffs, and gathers in the sides for best fit.
715201025,KNICKS TEE,T-shirt,Garment Upper body,Dark Blue,T-shirt in soft, printed cotton jersey.
715210002,Jinek shorts,Shorts,Garment Lower body,Greenish Khaki,Shorts in stretch twill with detachable, adjustable braces, concealed, adjustable elastication at the waist, fly with a press-stud and flap patch pockets.
715226003,ANDYS L/S,T-shirt,Garment Upper body,Dark Blue,Long-sleeved top in soft, printed cotton jersey.
715236003,Milly t-shirt price item,Top,Garment Upper body,Light Blue,Straight-style top in a soft, fine knit with a wide neckline, dropped shoulders and short, flounced sleeves.
715265001,Andrews set,Garment Set,Garment Full body,Dark Blue,Set with a short-sleeved shirt and a pair of shorts in a cotton weave. Shirt with a collar, buttons down the front and a chest pocket. Shorts with an adjustable elasticated waist, fake pockets and a detachable, braided belt.
715312004,Honolulu cord,Skirt,Garment Lower body,Off White,Short corduroy skirt with a regular waist and buttons at the top. Unlined.
715346001,SULLIVAN CREWNECK,Sweater,Garment Upper body,Dark Blue,Top in cotton piqué with long raglan sleeves and ribbing around the neckline, cuffs and hem.
715418001,Clark skinny trs,Trousers,Garment Lower body,Black,Suit trousers in stretch fabric made from a wool blend woven in a special way to make it more crease-resistant. The trousers have a concealed hook-and-eye fastener, zip fly, diagonal side pockets, jetted back pockets with a button, and legs with creases. Skinny fit – a fit with slightly shorter legs that is close-fitting at the thighs, knees and ankles to create a completely fitted silhouette.
715427001,Haylee Pull-on 2pack,Trousers,Garment Lower body,Dark Blue,Pull-on trousers in a patterned cotton weave with an elasticated drawstring waist, side pockets and elasticated hems.
715554001,ED Pomme tunic,Blouse,Garment Upper body,Black,V-neck tunic in an airy weave with a stand-up collar and buttons at the front. Gathered yoke at the back and long sleeves with buttoned cuffs. The tunic is made partly from recycled polyester.
715606005,SUPREME tights OL,Trousers,Garment Lower body,Dark Blue,Sports tights in fast-drying functional fabric with wide ribbing to hold in and shape the waist. Concealed key pocket in the waistband.
715610006,Pat ss bd light solid,Shirt,Garment Upper body,Dark Turquoise,Short-sleeved shirt in a cotton weave with a button-down collar and classic front. Yoke with a pleat at the back, a chest pocket, and a rounded hem. Regular Fit – a classic fit with good room for movement and a gently shaped waist to create a comfortable, tailored silhouette.
715624040,Becka hoodie,Hoodie,Garment Upper body,Light Grey,Long-sleeved top in soft sweatshirt fabric with a jersey-lined, drawstring hood, kangaroo pocket and ribbing at the cuffs and hem. Soft brushed inside.
715624041,Becka hoodie,Hoodie,Garment Upper body,Pink,Long-sleeved top in soft sweatshirt fabric with a jersey-lined, drawstring hood, kangaroo pocket and ribbing at the cuffs and hem. Soft brushed inside.
715652002,3p Socks,Socks,Socks & Tights,Beige,Fine-knit socks in a soft cotton blend with elasticated tops.
715779002,LOGG Cozy wrap top,Top,Garment Upper body,Dark Grey,Long-sleeved top in supersoft sweatshirt fabric with a brushed finish. Deep V-neck and a sewn-in wrapover front.
715786001,MC Emerald wrap,Top,Garment Upper body,Black,Wrapover top in jersey with a V-neck, seam and detachable tie belt at the waist and long, cuffed sleeves.
715876002,Tetra Pointelle Tee,Sweater,Garment Upper body,Black,Slightly shorter top in soft pointelle made from a viscose blend with short, rib-trimmed sleeves and a ribbed hem.
716045001,Paris trench,Jacket,Garment Upper body,Pink,Trenchcoat in woven fabric with notch lapels, a hook-and-eye fastening at the top and a loose yoke at the back. Detachable tie belt at the waist, side pockets, and a single back vent. Lined.
716178001,CAPRICORN OL,Vest top,Garment Upper body,Pink,Cropped vest top in soft viscose jersey with a deep neckline at the back and lace trim at the hem.
716211001,Aurora Fancy,Sweater,Garment Upper body,Dark Grey,Long-sleeved top in soft pile with a reversible sequin motif (sizes 1½-3Y with normal sequins). Ribbing around the neckline, cuffs and hem.
716348007,Marcie,Dress,Garment Full body,Light Beige,Short T-shirt dress in soft viscose jersey.
716548001,Brooklyn,Blouse,Garment Upper body,White,Straight-cut blouse in woven fabric with a slightly wider, round neckline and opening with a button at the back of the neck. Long sleeves and wide cuffs with a slit.
716590009,Jenny Sock 5-pack,Socks,Socks & Tights,Yellow,Socks in a soft fine-knit with elasticated tops.
716736002,NUBA ss body,Bodysuit,Garment Upper body,Dark Orange,Baby Exclusive. Short-sleeved bodysuits in soft organic cotton jersey, one ribbed and one patterned. Press-stud on one shoulder and at the crotch.
716746002,RUBY romper,Jumpsuit/Playsuit,Garment Full body,Light Turquoise,Baby Exclusive. Short-sleeved romper suit in soft terry made from an organic cotton blend with a narrow, elasticated seam at the waist. Press-studs at the back of the neck, concealed press-studs at the crotch and down the legs in sizes 0-2Y, and elasticated hems.
716957001,OL TEXAS PQ boot,Boots,Shoes,Black,Suede boots with pointed toes and block heels. Satin linings, leather insoles and rubber soles. Heel 5 cm.
716958001,Palma Trousers,Trousers,Garment Lower body,Black,Wide trousers in an airy weave with elastication at the back of the waist and a tie belt at the front. Straight legs with thigh-high slits. Unlined.
716958004,Palma Trousers,Trousers,Garment Lower body,Red,Wide trousers in an airy weave with elastication at the back of the waist and a tie belt at the front. Straight legs with thigh-high slits. Unlined.
716966002,NOAH LS x-mas,T-shirt,Garment Upper body,Dark Grey,Long-sleeved top in soft cotton jersey with a print motif and a rounded hem. Slightly longer at the back.
717065002,Nolita set,Dress,Garment Full body,Light Pink,Top and pair of shorts in soft, brushed jersey. Top with low dropped shoulders, long sleeves and slits in the sides. Slightly longer at the back. Shorts with an elasticated waist and side pockets.
717229001,Rhinestone gold earring,Earring,Accessories,Gold,Metal earrings decorated with sparkly stones. Length 10 cm.
717244002,PE CAPRI SHIRT,Shirt,Garment Upper body,Dark Blue,Shirt in a textured viscose weave with a collar, buttons down the front and long sleeves with buttoned cuffs. High slits in the sides and ties at the hem.
717475002,Muffin s/l,Blouse,Garment Upper body,White,Sleeveless, V-neck blouse in woven fabric with a wrapover front, pleats at the shoulders, pleat at the back and narrow elastication at the hem. Concealed press-stud at the front and a practical inner top for easier nursing access.
717490002,Cat Tee.,T-shirt,Garment Upper body,White,T-shirt in soft jersey.
717490017,Cat Tee.,T-shirt,Garment Upper body,Light Orange,T-shirt in soft jersey.
