article_id,product_code,prod_name,product_type_no,product_type_name,product_group_name,graphical_appearance_no,graphical_appearance_name,colour_group_code,colour_group_name,perceived_colour_value_id,perceived_colour_value_name,perceived_colour_master_id,perceived_colour_master_name,department_no,department_name,index_code,index_name,index_group_no,index_group_name,section_no,section_name,garment_group_no,garment_group_name,detail_desc
854406003,854406,AVA FRILL,255,T-shirt,Garment Upper body,1010016,Solid,11,Off White,1,Dusty Light,9,White,7920,Kids Girl Jersey Basic,H,Children Sizes 92-140,4,Baby/Children,79,Girls Underwear & Basics,1002,Jersey Basic,"Straight-style top in soft slub jersey made from organic cotton. Round neckline with a narrow ribbed trim, and flutter sleeves."
854573001,854573,DARCY DENIM SHIRT,259,Shirt,Garment Upper body,1010023,Denim,72,Blue,7,Medium,2,Blue,1543,Tops Woven,D,Divided,2,Divided,53,Divided Collection,1010,Blouses,"Shirt in washed, stretch denim with a collar, press-studs down the front and flap chest pockets with a press-stud. Long sleeves with press-studs at the cuffs, and a gently rounded hem."
854679003,854679,C Lolly Highwaist,59,Swimwear bottom,Swimwear,1010026,Other structure,21,Light Yellow,3,Light,8,Yellow,4242,Swimwear,B,Lingeries/Tights,1,Ladieswear,60,"Womens Swimwear, beachwear",1018,Swimwear,"Fully lined, waist-high bikini bottoms with a high cut at the back. The polyester content of the outer fabric is partly recycled. The polyester content of the lining is recycled."
854737001,854737,New Amber low boot,87,Boots,Shoes,1010016,Solid,9,Black,4,Dark,5,Black,3529,Boots,C,Ladies Accessories,1,Ladieswear,64,Womens Shoes,1020,Shoes,Biker ankle boots in imitation leather with decorative tabs and metal buckles at one side and a zip at the other. Fabric linings and insoles. Heel 3 cm.
854818001,854818,Raven HW Skirt,275,Skirt,Garment Lower body,1010016,Solid,9,Black,4,Dark,5,Black,1643,Basic 1,D,Divided,2,Divided,51,Divided Basics,1002,Jersey Basic,"Short, fitted skirt in stretch jersey with covered elastication at the waist."
855080002,855080,Frida push up seamless,-1,Unknown,Unknown,1010010,Melange,7,Grey,1,Dusty Light,12,Grey,1339,Clean Lingerie,B,Lingeries/Tights,1,Ladieswear,61,Womens Lingerie,1017,"Under-, Nightwear","Non-wired push-up bra designed with the minimum number of seams for a seamless, comfortable feel against the skin. Padded cups for a larger bust and fuller cleavage, adjustable shoulder straps and a hook-and-eye fastening at the back."
855080005,855080,Frida push up seamless,-1,Unknown,Unknown,1010016,Solid,51,Light Pink,1,Dusty Light,4,Pink,1339,Clean Lingerie,B,Lingeries/Tights,1,Ladieswear,61,Womens Lingerie,1017,"Under-, Nightwear","Non-wired push-up bra designed with the minimum number of seams for a seamless, comfortable feel against the skin. Padded cups for a larger bust and fuller cleavage, adjustable shoulder straps and a hook-and-eye fastening at the back."
855249007,855249,Lake,265,Dress,Garment Full body,1010016,Solid,19,Greenish Khaki,4,Dark,20,Khaki green,1322,Dress,A,Ladieswear,1,Ladieswear,15,Womens Everyday Collection,1013,Dresses Ladies,Calf-length dress in woven fabric. Wide fit with an opening and covered button at the back of the neck and short puff sleeves with narrow cuffs. Seam at the waist and a flared skirt with a flounce at the hem.
855386002,855386,Multi mop hair elastic,73,Hair string,Accessories,1010011,Metallic,5,Gold,5,Bright,15,Metal,3420,Small Accessories Extended,C,Ladies Accessories,1,Ladieswear,66,Womens Small accessories,1019,Accessories,Hair elastic with plastic beads.
855716003,855716,Ezra Washed Tee 12.99:-,255,T-shirt,Garment Upper body,1010016,Solid,13,Beige,2,Medium Dusty,11,Beige,5882,Jersey Fancy,F,Menswear,3,Menswear,55,Contemporary Street,1005,Jersey Fancy,T-shirt in soft cotton jersey with a washed look. Ribbing around the neckline and an open chest pocket.
855735002,855735,Abigail blouse,258,Blouse,Garment Upper body,1010016,Solid,15,Greyish Beige,2,Medium Dusty,1,Mole,1515,Blouse,A,Ladieswear,1,Ladieswear,11,Womens Tailoring,1010,Blouses,"Blouse in an airy crêpe weave. Stand-up collar with gathers front and back, a V-neck opening at the front with narrow ties at the top and flutter sleeves. Unlined."
855805002,855805,Stina sandal,91,Sandals,Shoes,1010001,All over pattern,71,Light Blue,3,Light,2,Blue,6561,Baby Shoes,G,Baby Sizes 50-98,4,Baby/Children,42,Kids & Baby Shoes,1020,Shoes,"Sandals in patterned ethylene-vinyl acetate with a small loop at the back and straps with hook and loop fasteners. Lined in jersey made from recycled polyester. Moulded insoles with a textured pattern to give the feet a better grip, and patterned soles."
855816003,855816,Gwen F&F Pufflseave,265,Dress,Garment Full body,1010016,Solid,9,Black,4,Dark,5,Black,1344,Dresses,D,Divided,2,Divided,53,Divided Collection,1013,Dresses Ladies,"Short dress in crinkled jersey with a sweetheart neckline, short puff sleeves with gathered elastication, a seam at the waist and a flared skirt. The polyester content of the dress is partly recycled."
855847003,855847,Ebba Low Sneaker SB,94,Sneakers,Shoes,1010016,Solid,9,Black,4,Dark,5,Black,4211,Kids Boy Shoes,J,"Children Accessories, Swimwear",4,Baby/Children,42,Kids & Baby Shoes,1020,Shoes,Trainers in imitation leather with mesh linings and insoles and patterned soles.
856011001,856011,TEMPEST SHORTS,274,Shorts,Garment Lower body,1010018,Treatment,8,Dark Grey,4,Dark,12,Grey,6545,Baby Boy Jersey Fancy,G,Baby Sizes 50-98,4,Baby/Children,41,Baby Boy,1005,Jersey Fancy,"Shorts in lightweight, denim-look sweatshirt fabric made from a soft cotton blend. Elasticated, drawstring waist, diagonal side pockets and back pockets."
856109001,856109,Sweaty,272,Trousers,Garment Lower body,1010016,Solid,9,Black,4,Dark,5,Black,1676,Jersey Basic,A,Ladieswear,1,Ladieswear,16,Womens Everyday Basics,1002,Jersey Basic,"Trousers in soft sweatshirt fabric made from a cotton blend. High waist with covered elastication and a drawstring, side pockets and slim, tapered legs."
856310003,856310,Oregano dress,265,Dress,Garment Full body,1010026,Other structure,22,Yellow,4,Dark,8,Yellow,1636,Jersey fancy,A,Ladieswear,1,Ladieswear,15,Womens Everyday Collection,1005,Jersey Fancy,"Calf-length dress in crinkled jersey with narrow, adjustable shoulder straps, a frill-trimmed, smocked bodice and softly draping, flared skirt. Unlined."
856346002,856346,Hat Kurt Cowboy,76,Hat/brim,Accessories,1010016,Solid,9,Black,4,Dark,5,Black,9985,Accessories,F,Menswear,3,Menswear,25,Men Accessories,1019,Accessories,Sturdy hat in felted wool with an indented crown and corded band. Lightly padded sweatband. Width of brim 9 cm.
856775003,856775,Twist tee,255,T-shirt,Garment Upper body,1010016,Solid,9,Black,4,Dark,5,Black,8716,Young Girl Jersey Fancy,I,Children Sizes 134-170,4,Baby/Children,77,Young Girl,1005,Jersey Fancy,"Short-sleeved top in soft viscose jersey with a narrow trim around the neckline, seam centre front and a twisted detail at the hem."
856786003,856786,Francesca Dress,265,Dress,Garment Full body,1010001,All over pattern,51,Light Pink,1,Dusty Light,4,Pink,1343,Projects Dresses,D,Divided,2,Divided,50,Divided Projects,1013,Dresses Ladies,"Short dress in patterned plumeti chiffon with short, softly draping sleeves and an open section at the back with a covered button at the back of the neck. Gathered seam under the bust, a concealed zip at the back and a gently flared skirt. Lined in jersey made from recycled polyester."
856798001,856798,Gilda capri leggings,273,Leggings/Tights,Garment Lower body,1010018,Treatment,73,Dark Blue,4,Dark,2,Blue,8716,Young Girl Jersey Fancy,I,Children Sizes 134-170,4,Baby/Children,77,Young Girl,1005,Jersey Fancy,"3/4-length leggings in sturdy, denim-look jersey with an elasticated waist and fake fly. Fake front pockets, real back pockets and short slits at the hems."
856840001,856840,Persilja,265,Dress,Garment Full body,1010001,All over pattern,12,Light Beige,1,Dusty Light,11,Beige,1636,Jersey fancy,A,Ladieswear,1,Ladieswear,15,Womens Everyday Collection,1005,Jersey Fancy,"Knee-length, A-line dress in jersey with a gathered seam and flounce at the hem for added volume. Unlined."
856919003,856919,Agnes rib SL set (J),297,Pyjama set,Nightwear,1010010,Melange,6,Light Grey,1,Dusty Light,12,Grey,3709,Nightwear,B,Lingeries/Tights,1,Ladieswear,62,"Womens Nightwear, Socks & Tigh",1017,"Under-, Nightwear","Pyjama top and shorts in soft, ribbed cotton jersey. Top with a rib-trimmed neckline and short sleeves with overlocked edges. Shorts with covered elastication at the waist and overlocked hems."
856997001,856997,Wendy waist,67,Belt,Accessories,1010016,Solid,33,Dark Orange,4,Dark,11,Beige,3509,Belts,C,Ladies Accessories,1,Ladieswear,65,Womens Big accessories,1019,Accessories,Waist belt in imitation suede with a round metal buckle. Width approx. 6 cm.
857030003,857030,&denim shaping ultra HW ancle,272,Trousers,Garment Lower body,1010023,Denim,73,Dark Blue,4,Dark,2,Blue,1774,OL Extended Sizes,A,Ladieswear,1,Ladieswear,57,Ladies Denim,1016,Trousers Denim,"5-pocket, ankle-length jeans in washed, stretch denim with an extra-high waist, zip fly and button and skinny legs. Shaping – denim with a stretch function that holds in and shapes the waist, thighs and bum while keeping the jeans in shape."
857224002,857224,Katie straw shopper,66,Bag,Accessories,1010016,Solid,33,Dark Orange,4,Dark,11,Beige,3209,Bags,C,Ladies Accessories,1,Ladieswear,65,Womens Big accessories,1019,Accessories,Shopper in braided paper straw with a fringed top edge and two handles at the top. Lined. Depth 16 cm. Height approx. 26 cm. Width approx. 30 cm.
857421002,857421,SIBLINGS TEE,255,T-shirt,Garment Upper body,1010008,Front print,81,Light Turquoise,1,Dusty Light,19,Green,7616,Kids Girl Jersey Fancy,H,Children Sizes 92-140,4,Baby/Children,76,Kids Girl,1005,Jersey Fancy,Classic T-shirt in soft cotton jersey with a text print on the front and round neckline with a narrow trim.
857427006,857427,ANGELICA TANK,254,Top,Garment Upper body,1010001,All over pattern,30,Other Orange,3,Light,3,Orange,1543,Tops Woven,D,Divided,2,Divided,53,Divided Collection,1010,Blouses,"Sleeveless blouse in woven fabric with a collar, buttons down the front, yoke with a pleat at the back, and a gently rounded hem with short slits in the sides. Unlined."
857427007,857427,ANGELICA TANK,254,Top,Garment Upper body,1010016,Solid,92,Green,1,Dusty Light,20,Khaki green,1543,Tops Woven,D,Divided,2,Divided,53,Divided Collection,1010,Blouses,"Sleeveless blouse in woven fabric with a collar, buttons down the front, yoke with a pleat at the back, and a gently rounded hem with short slits in the sides. Unlined."
857512005,857512,Molko pull on shorts,274,Shorts,Garment Lower body,1010001,All over pattern,51,Light Pink,3,Light,4,Pink,7617,Kids Girl Trouser,H,Children Sizes 92-140,4,Baby/Children,76,Kids Girl,1009,Trousers,"Pull-on shorts in stretch cotton twill with covered elastication at the waist, a fake fly and fake front pockets."
857545002,857545,Taylor WP Runner,94,Sneakers,Shoes,1010016,Solid,73,Dark Blue,4,Dark,2,Blue,4211,Kids Boy Shoes,J,"Children Accessories, Swimwear",4,Baby/Children,42,Kids & Baby Shoes,1020,Shoes,"Waterproof trainers in mesh with imitation leather details. Padded edge and tongue, elasticated lacing and a hook and loop tab at the front, and a contrasting colour grosgrain loop at the back. Reflective details. Linings and moulded insoles in mesh."
857586003,857586,Stenmark,262,Jacket,Garment Upper body,1010016,Solid,19,Greenish Khaki,4,Dark,20,Khaki green,6512,Baby Boy Outdoor,G,Baby Sizes 50-98,4,Baby/Children,41,Baby Boy,1007,Outdoor,"Jacket in coated cotton twill with a detachable, faux shearling-lined hood and stand-up collar. Zip down the front with a chin guard, welt side pockets, and inner ribbing at the cuffs. Faux shearling lining. The polyester content of the jacket is partly recycled."
858080001,858080,Robin straw,66,Bag,Accessories,1010016,Solid,33,Dark Orange,2,Medium Dusty,13,Brown,3209,Bags,C,Ladies Accessories,1,Ladieswear,65,Womens Big accessories,1019,Accessories,Sturdy shopper in braided seagrass decorated with tassels and shell-shaped plastic beads at the front. Two imitation leather handles. Unlined. Depth 15 cm. Width 36 cm. Height 32.5 cm.
858306005,858306,Esther set 2pcs,494,Accessories set,Accessories,1010016,Solid,9,Black,4,Dark,5,Black,2950,Baby Toys/Acc,G,Baby Sizes 50-98,4,Baby/Children,44,Baby Essentials & Complements,1019,Accessories,"Fleece-lined set with a hat and pair of mittens in a soft cable knit. Hat with a faux fur pompom on top, small imitation suede appliqué on the front, earflaps and ties under the chin. Mittens with ribbed cuffs. Sizes 0-2M and 2-6M without thumbs."
858320003,858320,Kaa bootie,464,Pre-walkers,Shoes,1010016,Solid,9,Black,4,Dark,5,Black,2950,Baby Toys/Acc,G,Baby Sizes 50-98,4,Baby/Children,44,Baby Essentials & Complements,1019,Accessories,"Bootees in windproof, water-repellent functional fabric with elastication around the ankles and top. Soft fleece linings and insoles and soft soles. The bootees have a water-repellent coating without fluorocarbons."
858329001,858329,Lagos Dress,265,Dress,Garment Full body,1010016,Solid,9,Black,4,Dark,5,Black,1322,Dress,A,Ladieswear,1,Ladieswear,15,Womens Everyday Collection,1013,Dresses Ladies,"Short, fitted dress in a linen and viscose weave. Concealed zip at the back with a hook-and-eye fastening at the top and long, raglan balloon sleeves with gathered seams front and back and close-fitting cuffs with concealed buttons. Satin lining."
858350001,858350,ED Roxanne dress,265,Dress,Garment Full body,1010001,All over pattern,9,Black,4,Dark,19,Green,1909,Woven top,A,Ladieswear,1,Ladieswear,2,H&M+,1010,Blouses,"Short dress in patterned, crinkled chiffon with a slightly wider neckline that has gathers at the front and an opening with ties at the back. Flounces down the front that continue down the back, long dolman sleeves with narrow elastication and ties at the cuffs and a narrow, elasticated seam at the waist. V-neck jersey inner dress. The polyester content of the dress is partly recycled."
858444001,858444,Sun tank,253,Vest top,Garment Upper body,1010014,Placement print,9,Black,4,Dark,5,Black,8716,Young Girl Jersey Fancy,I,Children Sizes 134-170,4,Baby/Children,77,Young Girl,1005,Jersey Fancy,Vest top in airy jersey with a print motif and rounded hem.
858740002,858740,Mable ballerina,86,Ballerinas,Shoes,1010016,Solid,51,Light Pink,7,Medium,4,Pink,6561,Baby Shoes,G,Baby Sizes 50-98,4,Baby/Children,42,Kids & Baby Shoes,1020,Shoes,"Ballet pumps in imitation leather with an adjustable hook and loop strap over the foot. Linings and insoles in a cotton weave, and patterned soles with a good grip."
859025001,859025,Matrix Tee,255,T-shirt,Garment Upper body,1010008,Front print,9,Black,4,Dark,5,Black,8558,Men Sport Tops,S,Sport,26,Sport,22,Men H&M Sport,1007,Outdoor,Short-sleeved sports top in airy jersey with a print motif and slits in the sides. Longer at the back.
859077016,859077,Nora dress(1),265,Dress,Garment Full body,1010010,Melange,72,Blue,2,Medium Dusty,2,Blue,1676,Jersey Basic,A,Ladieswear,1,Ladieswear,16,Womens Everyday Basics,1002,Jersey Basic,"Short, straight-style T-shirt dress in soft jersey made from a cotton blend with a round, slightly wider neckline. Short sleeves with sewn-in turn-ups, and short slits in the sides. Unlined."
859077018,859077,Nora dress(1),265,Dress,Garment Full body,1010016,Solid,63,Dark Purple,4,Dark,6,Lilac Purple,1676,Jersey Basic,A,Ladieswear,1,Ladieswear,16,Womens Everyday Basics,1002,Jersey Basic,"Short, straight-style T-shirt dress in soft jersey made from a cotton blend with a round, slightly wider neckline. Short sleeves with sewn-in turn-ups, and short slits in the sides. Unlined."
859136003,859136,Manchester dress,265,Dress,Garment Full body,1010017,Stripe,12,Light Beige,1,Dusty Light,9,White,1666,Jersey,A,Ladieswear,1,Ladieswear,11,Womens Tailoring,1005,Jersey Fancy,"Short-sleeved, knee-length dress in stretch jersey crêpe with a wrapover V-neck, seam at the waist and bell-shaped skirt. Unlined."
859174018,859174,Bosse 5-P,302,Socks,Socks & Tights,1010017,Stripe,51,Light Pink,1,Dusty Light,4,Pink,6541,Baby Socks,G,Baby Sizes 50-98,4,Baby/Children,44,Baby Essentials & Complements,1021,Socks and Tights,"Socks in a soft, fine-knit cotton blend with elasticated tops."
859174029,859174,Bosse 5-P,302,Socks,Socks & Tights,1010001,All over pattern,51,Light Pink,1,Dusty Light,4,Pink,6541,Baby Socks,G,Baby Sizes 50-98,4,Baby/Children,44,Baby Essentials & Complements,1021,Socks and Tights,"Socks in a soft, fine-knit cotton blend with elasticated tops."
859236006,859236,Tropicana Tie Tanga,59,Swimwear bottom,Swimwear,1010026,Other structure,9,Black,4,Dark,5,Black,4242,Swimwear,B,Lingeries/Tights,1,Ladieswear,60,"Womens Swimwear, beachwear",1018,Swimwear,"Fully lined bikini bottoms with a low waist, ties at the sides and medium coverage at the back."
859247003,859247,Lucien,258,Blouse,Garment Upper body,1010016,Solid,12,Light Beige,1,Dusty Light,11,Beige,1522,Blouse,A,Ladieswear,1,Ladieswear,15,Womens Everyday Collection,1010,Blouses,"Blouse in an airy weave with a stand-up collar and gathers at the top both front and back to create soft draping. Opening at the back with buttons at the back of the neck, long balloon sleeves with close-fitting, buttoned cuffs, and a gently rounded hem."
859274001,859274,CO-LAB EMMA Jane Livia bikini,299,Swimwear set,Swimwear,1010001,All over pattern,81,Light Turquoise,3,Light,7,Turquoise,4310,Kids Girl Swimwear,J,"Children Accessories, Swimwear",4,Baby/Children,43,"Kids Accessories, Swimwear & D",1018,Swimwear,EMMA JAYNE x H&M. Patterned bikini. Top with a flounce at the top that continues over one shoulder and a narrow strap over the other shoulder. Matching bottoms with a lined gusset.
859579001,859579,Will s/s shirt,259,Shirt,Garment Upper body,1010016,Solid,73,Dark Blue,2,Medium Dusty,2,Blue,8757,Young Boy Shirt,I,Children Sizes 134-170,4,Baby/Children,47,Young Boy,1011,Shirts,"Shirt in woven fabric with a collar, buttons down the front and a yoke with a pleat at the back. Open chest pocket, short sleeves with sewn-in turn-ups, and a rounded hem."
859579002,859579,Will s/s shirt,259,Shirt,Garment Upper body,1010001,All over pattern,10,White,3,Light,9,White,8757,Young Boy Shirt,I,Children Sizes 134-170,4,Baby/Children,47,Young Boy,1011,Shirts,"Shirt in woven fabric with a collar, buttons down the front and a yoke with a pleat at the back. Open chest pocket, short sleeves with sewn-in turn-ups, and a rounded hem."
859597001,859597,Flirty Christine ring pk,79,Ring,Accessories,1010016,Solid,5,Gold,5,Bright,15,Metal,4344,Jewellery,C,Ladies Accessories,1,Ladieswear,66,Womens Small accessories,1019,Accessories,Thin metal rings in various designs.
859622002,859622,Barcelona tunic dress,265,Dress,Garment Full body,1010016,Solid,19,Greenish Khaki,4,Dark,20,Khaki green,1310,Dress,A,Ladieswear,1,Ladieswear,6,Womens Casual,1013,Dresses Ladies,"Short dress in an airy viscose weave with a collar, buttons down the front, gently dropped shoulders and long sleeves with a tab and button. Gathered seam at the waist and a wide, softly draping skirt. Unlined."
859711001,859711,Denver waist,67,Belt,Accessories,1010016,Solid,9,Black,4,Dark,5,Black,3509,Belts,C,Ladies Accessories,1,Ladieswear,65,Womens Big accessories,1019,Accessories,"Wide waist belt in sturdy fabric with a covered, rectangular buckle. Width 6.5 cm."
860479002,860479,Karl s/l pj BB,297,Pyjama set,Nightwear,1010008,Front print,7,Grey,1,Dusty Light,12,Grey,4225,Young Boy UW/NW,I,Children Sizes 134-170,4,Baby/Children,72,Boys Underwear & Basics,1017,"Under-, Nightwear",Pyjama T-shirt and shorts in soft cotton jersey. T-shirt with a print motif on the front. Shorts with an elasticated waist.
860578001,860578,Cool Vera earring,70,Earring,Accessories,1010016,Solid,5,Gold,5,Bright,15,Metal,4345,Jewellery Extended,C,Ladies Accessories,1,Ladieswear,66,Womens Small accessories,1019,Accessories,Large metal earrings in the shape of a face. Length 9 cm.
860632002,860632,Hailey  Shorts,274,Shorts,Garment Lower body,1010016,Solid,51,Light Pink,1,Dusty Light,4,Pink,7930,Young Girl Jersey Basic,I,Children Sizes 134-170,4,Baby/Children,79,Girls Underwear & Basics,1002,Jersey Basic,"Shorts in lightweight organic cotton sweatshirt fabric. Elasticated waistband with a drawstring, and diagonal side pockets."
860632008,860632,HAILEY shorts,274,Shorts,Garment Lower body,1010017,Stripe,73,Dark Blue,4,Dark,2,Blue,7930,Young Girl Jersey Basic,I,Children Sizes 134-170,4,Baby/Children,79,Girls Underwear & Basics,1002,Jersey Basic,"Shorts in lightweight organic cotton sweatshirt fabric. Elasticated waistband with a drawstring, and diagonal side pockets."
860646001,860646,VIOLET LS BLOUSE,258,Blouse,Garment Upper body,1010016,Solid,10,White,3,Light,9,White,1543,Tops Woven,D,Divided,2,Divided,53,Divided Collection,1010,Blouses,"Cold shoulder blouse in a crêpe weave with narrow, adjustable shoulder straps and long sleeves. Double-layered flounce at the top and narrow elastication and a frill trim at the cuffs and hem."
860658001,860658,AMELIA SS BLOUSE,253,Vest top,Garment Upper body,1010016,Solid,10,White,3,Light,9,White,1543,Tops Woven,D,Divided,2,Divided,53,Divided Collection,1010,Blouses,"Blouse in a crinkled weave with lace trims and flutter sleeves. Round neck with a scalloped, crocheted trim and an opening with a button at the back of the neck. Unlined."
860696011,860696,Single anklesock,302,Socks,Socks & Tights,1010001,All over pattern,92,Green,5,Bright,19,Green,7921,Kids Girl S&T,H,Children Sizes 92-140,4,Baby/Children,79,Girls Underwear & Basics,1021,Socks and Tights,"Socks in a soft, fine-knit cotton blend with elasticated tops."
860720001,860720,+ 2-pack Energy fitted tank,253,Vest top,Garment Upper body,1010016,Solid,9,Black,4,Dark,5,Black,1919,Jersey,A,Ladieswear,1,Ladieswear,2,H&M+,1005,Jersey Fancy,Sports vest tops in fast-drying functional fabric with a racer back.
860813001,860813,Russ high top,94,Sneakers,Shoes,1010016,Solid,10,White,3,Light,9,White,3629,Shoes,F,Menswear,3,Menswear,27,Men Shoes,1020,Shoes,Hi-tops in cotton canvas with lacing at the front and rubber toe caps. Canvas linings and insoles and rubber soles.
860819001,860819,Mermaid Push Bra,298,Bikini top,Swimwear,1010017,Stripe,72,Blue,1,Dusty Light,2,Blue,4242,Swimwear,B,Lingeries/Tights,1,Ladieswear,60,"Womens Swimwear, beachwear",1018,Swimwear,"Lined bikini top with underwired, padded cups for a larger bust and fuller cleavage. Small frill trim at the top, a decorative bow with metal pendants at the front, ties at the back of the neck and a metal fastener at the back."
860822001,860822,Meraki Unpadded wire,306,Bra,Underwear,1010016,Solid,9,Black,4,Dark,5,Black,1338,Expressive Lingerie,B,Lingeries/Tights,1,Ladieswear,61,Womens Lingerie,1017,"Under-, Nightwear","Non-padded bra in mesh with underwired, unlined cups that give the bust a natural shape. Adjustable shoulder straps and a hook-and-eye fastening at the back."
860897001,860897,CE avignon strap top,253,Vest top,Garment Upper body,1010016,Solid,12,Light Beige,1,Dusty Light,11,Beige,7020,Conscious Exclusive,A,Ladieswear,1,Ladieswear,82,Special Collections,1023,Special Offers,"CONSCIOUS EXCLUSIVE. Top in matt satin made from a silk and Tencel™ lyocell blend with wide, tie-top shoulder straps in a contrasting colour and a V-neck. Opening with a covered button at the back and slits in the sides. Lined at the top. The top is dyed in a natural, sustainable way using coffee."
861477001,861477,Clean Bandit Top,298,Bikini top,Swimwear,1010016,Solid,9,Black,4,Dark,5,Black,4242,Swimwear,B,Lingeries/Tights,1,Ladieswear,60,"Womens Swimwear, beachwear",1018,Swimwear,"Lined bandeau bikini top with side support and cups with removable inserts that shape the bust and provide good support. Narrow, double shoulder straps, and a drawstring front and back. No fasteners."
861574004,861574,Ted Sock Runner SB,94,Sneakers,Shoes,1010005,Colour blocking,20,Other Yellow,5,Bright,8,Yellow,4211,Kids Boy Shoes,J,"Children Accessories, Swimwear",4,Baby/Children,42,Kids & Baby Shoes,1020,Shoes,"Fully-fashioned trainers with details in imitation leather. Elasticated top edge, a loop front and back, and elasticated lacing with a drawstring at the top. Mesh insoles and patterned soles."
861712001,861712,HS Peplum short,265,Dress,Garment Full body,1010007,Embroidery,10,White,3,Light,-1,Unknown,3090,Campaigns,A,Ladieswear,1,Ladieswear,15,Womens Everyday Collection,1023,Special Offers,"Calf-length, A-line dress in crisp, organic cotton poplin with a V-shaped opening at the top and stand-up collar with narrow ties. Short, voluminous, embroidered raglan puff sleeves with covered elastication and a frill trim. Discreet pockets in the side seams and a visible seam down the front and back. Unlined."
861833001,861833,Blinking sandal SB,91,Sandals,Shoes,1010001,All over pattern,73,Dark Blue,4,Dark,2,Blue,4211,Kids Boy Shoes,J,"Children Accessories, Swimwear",4,Baby/Children,42,Kids & Baby Shoes,1020,Shoes,Sandals in imitation leather with a relief print and an ankle strap with a hook and loop fastening. Imitation leather linings and insoles and transparent soles with motion-activated flashing lights.
861838001,861838,POPPY 2-p top,253,Vest top,Garment Upper body,1010012,Mixed solid/pattern,51,Light Pink,1,Dusty Light,4,Pink,7920,Kids Girl Jersey Basic,H,Children Sizes 92-140,4,Baby/Children,79,Girls Underwear & Basics,1002,Jersey Basic,Sleeveless tops in soft jersey with a gathered seam and wide flounce at the hem. The cotton content of the tops is organic.
