article_id,prod_name,product_type_name,product_group_name,colour_group_name,detail_desc
761414001,Varys brodery anglais shorts,Shorts,Garment Lower body,White,Shorts in a cotton weave with broderie anglaise. Elasticated waist with a twisted, tasselled drawstring, side pockets and scalloped hems. Cotton poplin lining.
761493002,Andrea sunglasses,Sunglasses,Accessories,Black,Sunglasses with plastic frames and UV-protective, tinted lenses.
761821006,Bella,Dress,Garment Full body,Dark Blue,Dress with a soft jersey bodice, visible zip at the back and short cap sleeves. Seam at the waist and a lined, flared skirt in a patterned weave with a sheen.
761947002,ESSENTIAL RAVEN TEE STRIPE,T-shirt,Garment Upper body,Light Beige,T-shirt in striped cotton jersey with contrasting colour ribbing around the neckline.
761956002,Naomi dress,Dress,Garment Full body,Off White,Dress in an extra-soft, fine-knit cotton blend with long raglan sleeves and buttons at the back of the neck.
762086006,Hemmingway hood,Sweater,Garment Upper body,Light Beige,Cable-knit jumper in a cotton blend. Wrapover hood with a decorative drawstring, long sleeves, and ribbing at the cuffs and hem.
762154002,Torje xplorer parka,Hoodie,Garment Upper body,Dark Blue,Padded, quilted jacket in woven fabric with a fabric patch on the chest, a padded, lined drawstring hood and an adjustable tab with press-studs at the top. Two-way zip down the front with a chin guard and a wind flap with concealed press-studs. Chest pockets with a concealed zip, flap front pockets with concealed press-studs, concealed side pockets behind the front pockets and one inner pocket with a hook and loop fastening. Adjustable tabs with press-studs at the cuffs and a concealed drawstring at the hem. Lined. Polyester filling.
762173002,Paul windbreaker,Hoodie,Garment Upper body,Yellow,Windbreaker in a nylon weave with a lined, drawstring hood and a zip down the front. Side pockets, an inner pocket and elasticated cuffs. Lined.
762196001,Andie sweatshirt,Sweater,Garment Upper body,Light Grey,Boxy top in lightweight sweatshirt fabric with an embroidered text motif on the front, dropped shoulders and long sleeves. Ribbing around the neckline and cuffs, and a drawstring at the hem.
762331003,Hat reno Bucket cotton,Hat/brim,Accessories,Yellowish Brown,Bucket hat in cotton twill. Lined. Width of brim approx. 5 cm.
762767003,Frody Cord Trousers,Trousers,Garment Lower body,Dark Beige,Ankle-length trousers in cotton corduroy with a regular, adjustable, elasticated waist, zip fly and button, front and back pockets and straight, wide legs.
762896024,STELLA PRINTED,Scarf,Accessories,Other Orange,Scarf in a soft jacquard weave with fringes on the short sides.
763195007,TOBIE LS BB 5-p,Sweater,Garment Upper body,Greenish Khaki,Long-sleeved tops in soft jersey made from an organic cotton blend.
763280006,Peg,Sweater,Garment Upper body,Grey,Shorter jumper in a soft, fine knit with a ribbed turtle neck, long dolman sleeves, and ribbing at the cuffs and hem.
763484001,Harvey hood,Sweater,Garment Upper body,Light Grey,Jumper knitted in soft cotton with a lined, drawstring hood, button placket, kangaroo pocket and ribbing at the cuffs and hem.
763506001,Cool Drake necklace,Necklace,Accessories,Gold,Three-strand metal necklace with coin-shaped pendants. Adjustable length 42-50 cm.
763634007,AK Juniper jumper,Sweater,Garment Upper body,Black,Long-sleeved jumper in a soft chenille rib knit in a wide, slightly boxy style with low dropped shoulders, wide ribbing around the neckline, cuffs and hem and slits in the sides. Longer at the back.
763660002,Premium Poofs down jkt (PQ),Jacket,Garment Upper body,Greenish Khaki,Jacket in woven fabric with a filling of 80% down and 20% feathers. Detachable hood lined with soft faux fur, a small stand-up collar and zip down the front with a chin guard. Narrow elastication around the hood, cuffs and hem. Partly lined in fleece.
763735003,Pat ls bd flannel gingham,Shirt,Garment Upper body,Light Beige,Shirt in soft cotton flannel with a button-down collar, classic front and yoke with a pleat and hanger at the back. Open chest pocket, long sleeves with adjustable buttoning at the cuffs, and a rounded hem. Regular Fit – a classic fit with good room for movement and a gently tapered waist to create a comfortable, tailored silhouette.
763842008,Clementine dress,Dress,Garment Full body,Turquoise,Short, sleeveless dress in pleated jersey with a slight sheen. Round neckline with an opening and button at the back of the neck, a seam at the waist with a detachable tie belt, and a flared skirt. Unlined.
763862004,HOPE top,Bra,Underwear,Grey,Bra top in soft jersey made from a cotton blend with a racer back and elasticated hem.
763895001,Nasa interactive  tee,T-shirt,Garment Upper body,White,T-shirt in cotton jersey with reversible sequins on the front and a narrow ribbed trim around the neckline.
763988004,DOMINIC SWEATPANT,Trousers,Garment Lower body,Grey,Sweatpants with an elasticated drawstring waist in a relaxed style with a slightly lower crotch, pockets in the side seams and tapered legs with ribbed hems. Soft brushed inside. Regular fit.
764088001,Kylie shirt sl-set (J),Pyjama set,Nightwear,Black,Pyjamas with a short-sleeved shirt and pair of shorts in soft jersey. Shirt with a rounded collar and buttons down the front. Shorts with an elasticated waist.
764147008,Chris 5pk Basic,Underwear bottom,Underwear,Dark Blue,Trunks in stretch organic cotton jersey with flatlock seams, an elasticated waist, lined front and mid-length legs.
764514001,Mac,Dress,Garment Full body,Light Beige,Calf-length dress in an airy, patterned viscose weave with an opening and concealed button at the back of the neck, short, gently flared sleeves and smocking at the waist. Unlined.
764581001,Dahlia high apex push kahlua,Bra,Underwear,Black,Push-up bra in microfibre and lace with underwired, padded cups for a larger bust and fuller cleavage. Adjustable shoulder straps that are lace-covered at the front, and a hook-and-eye fastening at the back.
764684001,Flirty Jenny stud pk,Earring,Accessories,Gold,Small metal earrings in various designs, two pairs of hoops. Sizes from 0.3 cm to 2.5 cm.
764707004,FREDRICK shorts 3-p,Shorts,Garment Lower body,Light Blue,Shorts in soft cotton jersey with an elasticated, drawstring waist and fake side pockets.
764727002,Flirty Gaby necklace,Necklace,Accessories,Turquoise,Three-strand necklace of metal chains in various designs with plastic beads and metal pendants. Adjustable length 44-50 cm.
764895002,J Ballet,Dress,Garment Full body,Black,Knee-length dress in ribbed jersey with a ballerina neckline front and back, 3/4-length sleeves, seam at the waist and flared skirt. Unlined.
765362009,Markus,Sweater,Garment Upper body,Yellowish Brown,Jumper in soft, textured-knit cotton with a round neck, long sleeves and ribbing around the neckline, cuffs and hem.
765502001,Grey Megan jazz pants,Trousers,Garment Lower body,Dark Red,Trousers in ribbed velour with a high, elasticated waist and flared legs.
765739001,Super Skinny HW Ankle Vanessa,Trousers,Garment Lower body,Black,5-pocket, ankle-length jeans in washed, stretch denim with a high waist, zip fly and button, and super-skinny legs.
765907004,Alfie paletot,Coat,Garment Upper body,Dark Red,Single-breasted coat in a wool blend with notch lapels, a chest pocket, flap front pockets and two inner pockets. Decorative buttons at the cuffs and a single back vent. Lined.
766338001,Nana Anglais Dress,Dress,Garment Full body,Light Yellow,Sleeveless dress in a cotton weave with broderie anglaise, frills down the front that continue back over the shoulders, and buttons at the back. Seam at the waist and a flared skirt with a scalloped hem. Lined.
766402020,Laurent slim fit jogger,Trousers,Garment Lower body,Black,Ankle-length joggers in woven fabric with an elasticated, drawstring waist, diagonal side pockets and welt back pockets. Legs with creases and sewn-in turn-ups at the hems. Slim Fit – a fit that is close-fitting at the thighs, knees and ankles to create a fitted silhouette.
766448001,Mocca,Dress,Garment Full body,Light Beige,Long, sleeveless dress in patterned satin with a gathered, elasticated neckline, short, double shoulder straps and a seam at the waist with a detachable tie belt. Lined.
766450002,MILES s/s price tee,T-shirt,Garment Upper body,Light Grey,T-shirt in cotton jersey with a print motif on the front and ribbing around the neckline.
766450004,MILES s/s price tee,T-shirt,Garment Upper body,White,T-shirt in cotton jersey with a print motif on the front and ribbing around the neckline.
766450013,MILES s/s price tee,T-shirt,Garment Upper body,White,T-shirt in cotton jersey with a print motif on the front and ribbing around the neckline.
766495014,Kevin skirt,Skirt,Garment Lower body,Blue,Calf-length skirt in a softly draping weave with a high waist and concealed zip in one side. Unlined.
766572002,Olaf slim buckle trs,Trousers,Garment Lower body,Grey,Suit trousers in a softly draping weave made from a wool blend with an extended waistband, concealed hook-and-eye fastener and adjustable tabs with a metal fastener at the sides. Zip fly, side pockets and jetted back pockets with a button. Slightly shorter legs with creases and turn-ups at the hems. Slim fit that is close-fitting at the thighs, knees and ankles to create a fitted silhouette.
766606002,PEACH SKIRT,Shorts,Garment Lower body,Yellowish Brown,Short, A-line skirt in soft slub jersey. High waist with wide elastication and a small frill trim at the top.
766742002,Saint Hood,Sweater,Garment Upper body,Black,Short top in soft sweatshirt fabric with a jersey-lined, wrapover hood, long sleeves and ribbing at the cuffs and hem. Soft brushed inside.
766777006,Clara Fancy,Shorts,Garment Lower body,Other Orange,Shorts in lightweight sweatshirt fabric with an elasticated, drawstring waistband, side pockets and rounded hems. Contrasting colour stripes and trims at the sides and hems.
766785001,Ginny,Dress,Garment Full body,Dark Green,Long, sleeveless dress in an airy, patterned jacquard weave. Narrow cut at the top with an elasticated neckline and short shoulder straps with a sewn-on bow at one side. Narrow elasticated seam at the waist. Satin lining.
766955004,PIXI PINNAFORE,Skirt,Garment Lower body,Black,Short dungaree dress in soft fabric with adjustable straps with metal fasteners at the front. Lined at the top.
767079004,Atlantic hoodie,Hoodie,Garment Upper body,Grey,Oversized top in soft sweatshirt fabric made from a cotton blend with a jersey-lined, drawstring hood and side pockets. Low dropped shoulders, long sleeves and ribbing at the cuffs and hem. Soft brushed inside.
767191002,Algot pull-on clamdigger,Shorts,Garment Lower body,Grey,Knee-length shorts in a sturdy cotton weave with an elasticated drawstring waist and fake fly. Large patch front pockets and a patch pocket with a button at the back.
767256009,Voldemort set,Garment Set,Garment Full body,Black,Set in soft, lightweight sweatshirt fabric with a motif. Top with long raglan sleeves and ribbing around the neckline, cuffs and hem. Joggers with an elasticated waist, side pockets and ribbed hems.
767436003,Tiger Top,Bikini top,Swimwear,Beige,Lined bandeau bikini top with padded cups with removable inserts, narrow tie-top shoulder straps, side support and straps that tie at the back.
767438004,Tiger Cheeky Brief,Swimwear bottom,Swimwear,Dark Red,Fully lined bikini bottoms with a mid waist, narrow sides and cutaway coverage at the back.
767577046,Robin 3pk Fancy,Underwear bottom,Underwear,Dark Blue,Trunks in stretch cotton jersey with flatlock seams, short legs, an elasticated waist and lined front.
767607001,Glove Malte,Gloves,Accessories,Black,Knitted gloves with imitation leather uppers and palms, and foldover cuffs. Fleece lining.
767687002,HONEY long bralette,Bra,Underwear,Light Pink,Bralette in fast-drying functional fabric with wide, adjustable shoulder straps that cross at the back and lined cups with removable inserts that shape the bust. The bra is designed with the minimum number of seams for a more comfortable fit and increased mobility. Light support.
767798001,Broken jacket denim,Jacket,Garment Upper body,Light Blue,Oversized jacket in washed denim with a collar, buttons down the front, dropped shoulders and long sleeves with buttoned cuffs. Flap chest pockets with a button, welt side pockets, and a tab with adjustable buttoning at the sides of the hem.
767799022,JUST PINK DRESS(1),Dress,Garment Full body,Dark Yellow,Sleeveless, calf-length dress in soft jersey made from a cotton blend. High slit in one side.
768269001,BEANIE KNIT CHUNKY FUR POM POM,Hat/beanie,Accessories,Dark Blue,Hat in a soft rib knit with a faux fur pompom on top and a turned-up hem.
768269005,BEANIE KNIT CHUNKY FUR POM POM,Hat/beanie,Accessories,Dark Grey,Hat in a soft rib knit with a faux fur pompom on top and a turned-up hem.
768360001,BB Air Ski Jkt,Jacket,Garment Upper body,Dark Blue,Padded ski jacket in windproof, water-repellent breathable functional fabric. Detachable, lined hood with an adjustable hook and loop tab at the back, and a zip down the front. Flap front pockets with a press-stud, a zipped inner pocket and zipped lift pass pocket on one sleeve. Long raglan sleeves with a hook and loop tab at the cuffs and jersey inner ribbing with thumbholes. Snow flap with press-studs and reinforced elastication at the waist. Lined. The jacket has a water-repellent coating without fluorocarbons.
768360002,BB Air Ski Jkt,Jacket,Garment Upper body,Greenish Khaki,Padded ski jacket in windproof, water-repellent breathable functional fabric. Detachable, lined hood with an adjustable hook and loop tab at the back, and a zip down the front. Flap front pockets with a press-stud, a zipped inner pocket and zipped lift pass pocket on one sleeve. Long raglan sleeves with a hook and loop tab at the cuffs and jersey inner ribbing with thumbholes. Snow flap with press-studs and reinforced elastication at the waist. Lined. The jacket has a water-repellent coating without fluorocarbons.
768406014,BB ASTON SHORTS,Swimwear bottom,Swimwear,Dark Turquoise,Patterned swim shorts with an elasticated drawstring waist and fake fly. Soft mesh inner shorts.
768440001,Tove top.,T-shirt,Garment Upper body,Black,Short top in soft cotton jersey with a round neckline, short sleeves and a seam at the hem with a decorative knot detail at the front.
768465002,Lucien,Blouse,Garment Upper body,Dark Beige,Blouse in an airy weave with a stand-up collar and gathers at the top, both front and back to create soft draping. Opening at the back with buttons at the back of the neck, long balloon sleeves with close-fitting, buttoned cuffs, and a gently rounded hem.
768635002,Odessa swimsuit,Swimsuit,Swimwear,White,Strapless swimsuit with a wide flounce at the top, narrow detachable straps that can be tied at the back of the neck, and a silicone trim at the top.
768921001,Tuby skirt,Skirt,Garment Lower body,Black,Short, fitted skirt in jersey with an elasticated waist.
769007005,Stature cargo pant,Trousers,Garment Lower body,Dark Grey,Joggers in cotton twill with an elasticated drawstring waist, side pockets, and flap back and leg pockets with concealed press-studs. Tapered legs with seams at the knees and ribbed hems.
769046001,Tess tights,Trousers,Garment Lower body,Dark Grey,Sports tights in fast-drying functional fabric with ribbing at the waist and inset elastication on the outside of the hems.
769102004,3P LS PJ,Pyjama jumpsuit/playsuit,Nightwear,Yellow,Long-sleeved, all-in-one pyjamas in soft, organic cotton jersey.
769102023,3P LS PJ,Pyjama jumpsuit/playsuit,Nightwear,White,Long-sleeved, all-in-one pyjamas in soft, organic cotton jersey.
769102051,3PACK LS PJ TVP,Pyjama jumpsuit/playsuit,Nightwear,Blue,Long-sleeved, all-in-one pyjamas in soft, organic cotton jersey.
769321001,Papa skirt,Skirt,Garment Lower body,Pink,Calf-length wrapover skirt in a crêpe weave made from a Tencel™ lyocell blend with a concealed fastening at the waist and grosgrain ties at one side. Pockets in the side seams and a slit in the sides. Lined.
769400003,RR 47.1/2 /3Leo shirt dress,Dress,Garment Full body,Black,Long-sleeved dress in chiffon crêpe with a V-neck, buttons at the front and a gently tapered waist with a gathered seam. Unlined.
769454001,Skinny SS trash,Trousers,Garment Lower body,Light Blue,5-pocket slim-fit jeans in washed, superstretch flexible denim for maximum mobility. Hard-worn details that are patched on the inside, an adjustable elasticated waist, zip fly and button, and narrow hems.
769681001,SB Johnson Running tights,Trousers,Garment Lower body,Black,Sports tights with elastication and a concealed drawstring at the waist, ventilating mesh sections at the back of the knees, and reflective details.
769699004,Ledger set,T-shirt,Garment Upper body,Light Grey,Set with a T-shirt and pair of joggers. T-shirt in cotton jersey with a print motif on the front. Joggers in sweatshirt fabric made from a cotton blend with covered elastication and a drawstring at the waist, side pockets and a print motif on one leg. Soft brushed inside.
769729005,BETTY deal hood,Hoodie,Garment Upper body,Grey,Long-sleeved top in sweatshirt fabric with a print motif, lined hood and ribbing at the cuffs and hem. Soft brushed inside.
769900001,Rachel biker,Underwear bottom,Underwear,Black,Shaping bikers in sturdy mesh with a high waist, lined gusset and legs. Light sculpting effect on the tummy, bum and thighs.
769929001,Sunglasses Anna 2pk,Sunglasses,Accessories,Other Pink,Sunglasses with patterned plastic frames and UV-protective, tinted lenses.
770021003,SPEED Timmy dress,Dress,Garment Full body,Dark Blue,Short, sleeveless dress in sturdy, textured jersey with a lace band at the waist, concealed zip at the back and flared skirt with lace bands at the hem.
770058004,BENDELA LS,T-shirt,Garment Upper body,Yellow,Short top in ribbed cotton jersey with a wide, round neckline, long sleeves and decorative buttons down the front.
770134001,BEANIE JERSEY OWN FANCY,Hat/beanie,Accessories,Dark Blue,Double-layered hat in printed jersey with a reversible sequin motif.
770221001,Herman waterproof,Boots,Shoes,Black,Boots in waterproof imitation leather with an ankle-height shaft, padded edge and hook and loop fastening at the front, Pile linings and insoles and chunky, patterned soles.
770321002,Kirsten Fleece M-gown (J),Robe,Underwear,White,Dressing gown in soft, textured pile with notch lapels and a detachable tie belt at the waist.
770352005,Nina n- shirt FLANNEL (W),Night gown,Nightwear,Light Pink,Long-sleeved nightshirt in soft, lightweight cotton flannel with notch lapels, buttons down the front and a yoke with a pleat at the back. Open chest pocket, buttoned cuffs and a rounded hem.
770709002,Solna crewneck,Sweater,Garment Upper body,White,Top in printed sweatshirt fabric with ribbing around the neckline, cuffs and hem.
770718001,Batty Halloween Skirt,Skirt,Garment Lower body,Black,Flared tulle skirt with a flock print, elastication with a flock print at the waist and an asymmetric hem. Lined.
770764004,Funct. Alfred waterproof,Boots,Shoes,Yellowish Brown,Waterproof hi-tops in imitation leather with a padded edge and tongue, adjustable hook and loop fastening at the front and a loop at the back. Soft pile linings and insoles and patterned soles.
770816004,Robbie Tee 6.99:-,T-shirt,Garment Upper body,Beige,T-shirt in soft cotton with contrasting colour panels along the shoulders and sleeves.
770831003,Rosalind Strap dress,Dress,Garment Full body,White,Maxi dress in an airy weave with narrow, adjustable shoulder straps, a wrapover front and narrow ties at the waist that fasten on one side. Lined.
770845001,Cake Top,Blouse,Garment Upper body,Dark Orange,Cropped top in seersucker made from a Tencel™ lyocell blend with elastication and a frill at the top, a sweetheart neckline and buttons down the front. Short, raglan puff sleeves with elastication and a frill trim.
770851001,Jennifer long,Blazer,Garment Upper body,Light Beige,Long jacket in soft viscose twill with notch lapels, flap welt front pockets, a gently tapered waist and long sleeves. No fasteners. Lined.
770857003,Alpaca Tunic,Blouse,Garment Upper body,Light Beige,Wide tunic in pattern-weave cotton with a small stand-up collar, opening at the front and ties at the top. Dropped shoulders and long wide sleeves with narrow buttoned cuffs. Tiers and a flounce at the hem.
771005002,Ophelia Brazilian Azalea,Underwear bottom,Underwear,White,Brazilian briefs in lace with a low waist, lined gusset and high cut at the back.
771005003,Ophelia Brazilian Azalea,Underwear bottom,Underwear,Light Orange,Brazilian briefs in lace with a low waist, lined gusset and high cut at the back.
771024002,SIBLINGS tee,T-shirt,Garment Upper body,Dark Blue,T-shirt in printed cotton jersey.
771026002,Caramel SET,Garment Set,Garment Full body,White,Set with a long-sleeved cotton jersey top and a skirt in a double layer of tulle. Top with a reversible sequin motif on the front (size 2-3Y with normal sequins). Skirt with a glittery elastic waistband. Lined.
771124001,Beast leo lace hw bottom,Underwear bottom,Underwear,Black,Thong briefs in lace and mesh with a small opening at the back. High waist, lined gusset and a string back.
771195001,Chris Runner Paw Patrol SB,Sneakers,Shoes,Blue,Trainers in patterned scuba fabric with elasticated lacing and a hook and loop tab at the front, a padded top edge and a loop at the back. Mesh linings and insoles and patterned soles.
771258001,ED Rihanna dress,Dress,Garment Full body,Dark Red,Short dress in patterned jersey with a slightly wider neckline and short cap sleeves with sewn-in turn-ups. Elasticated seam at the waist and side pockets.
771274004,ESSIE STRAP DRESS,Dress,Garment Full body,Light Pink,Sleeveless dress in soft, organic cotton jersey with a seam at the waist.
771348003,Monday jkt fleece lining,Jacket,Garment Upper body,Light Pink,Fleece-lined jacket in a patterned weave with a stand-up collar, detachable hood and zip down the front with a chin guard. Elastication around the hood, cuffs and hem.
771489004,GARETH ss 2-p,T-shirt,Garment Upper body,Yellow,T-shirts in airy cotton jersey with a chest pocket and short slits in the sides. Longer at the back.
771525001,Oliver hood,Sweater,Garment Upper body,Dark Blue,Top in soft, waffle-knit cotton with patches on the shoulders and elbows in woven fabric. Lined, drawstring hood and ribbing at the cuffs and hem.
771537001,Singo.,Dress,Garment Full body,Dark Red,Knee-length dress in pleated chiffon with narrow shoulder straps and a narrow tie belt at the waist. Lined.
771574001,BG TILLY jersey set,Garment Set,Garment Full body,Light Pink,Set with a long-sleeved top and pair of leggings in jersey and shorts in lightweight sweatshirt fabric. Top with a round neck and a small opening with a button at the back of the neck. Leggings with an elasticated waist. Shorts with an elasticated waist, detachable belt in braided imitation suede, fake fly with a heart-shaped button, and sewn-in turn-ups at the hems.
771826001,Whitney wrap dress,Top,Garment Upper body,Light Beige,Calf-length dress in a soft rib knit containing some wool with long sleeves and a wrapover front with wide ties at one side.
771829005,Noah cowl neck dress,Top,Garment Upper body,Grey,Calf-length dress in a soft knit containing some wool with a large, draped polo neck, dropped shoulders, ribbing at the cuffs and hem, and short slits in the sides.
771925001,Underwater glasses,Other accessories,Accessories,Other Pink,Swimming goggles with plastic frames, tinted lenses and an adjustable silicone strap at the back.
771995001,MERCURY button down oxford,Shirt,Garment Upper body,Light Blue,Straight-style Oxford cotton shirt with a button-down collar, French front, open chest pocket and gently tapered waist. Yoke with a pleat at the back, long sleeves with adjustable buttoning at the cuffs and a rounded hem.
772289001,Cool Isla hoop pk,Earring,Accessories,Gold,Metal hoop earrings in various sizes and designs. Length from 1 cm to 3 cm.
772344004,Mars fancy trouser,Trousers,Garment Lower body,Black,Slim-fit trousers in soft, superstretch twill for maximum mobility. Adjustable elasticated waist (in sizes 8-12Y), a zip fly and button, and tapered legs.
772344009,Mars fancy trouser,Trousers,Garment Lower body,Black,Slim-fit trousers in soft, superstretch twill for maximum mobility. Adjustable elasticated waist (in sizes 8-12Y), a zip fly and button, and tapered legs.
772349005,Glamping.(1),Shorts,Garment Lower body,Purple,Short shorts in lightweight sweatshirt fabric with an elasticated, drawstring jersey waistband, side pockets and rounded hems.
772486005,Hagrid sweater,Sweater,Garment Upper body,Dark Grey,Jumper in soft, fine-knit cotton with buttons on one shoulder, long sleeves and ribbing around the neckline, cuffs and hem.
772513002,Tina N T-shirt,T-shirt,Garment Upper body,Black,Short-sleeved top in soft jersey with a unique nursing feature. The design includes a double layer to help retain warmth while allowing easier nursing access.
772565006,Burcu Styling Scarf,Scarf,Accessories,Dark Grey,Scarf in soft, patterned satin.
772571003,YOGHURT V-NECK MERINO,Sweater,Garment Upper body,Dark Blue,V-neck jumper in a soft, fine-knit merino wool blend with long sleeves and ribbing around the neckline, cuffs and hem.
772711010,Jeff Linen Pullon,Shorts,Garment Lower body,Dark Blue,Shorts in a linen and cotton weave with an elasticated, drawstring waist, fake fly, side pockets and welt back pockets.
772751001,P Alba frill top,Blouse,Garment Upper body,Dark Red,Sleeveless top in a viscose crêpe weave with a unique nursing feature. V-neck with a pleat at the bottom, a frill trim around the armholes, and a gathered yoke at the back. The design includes a double layer to help retain warmth while allowing easier nursing access.
