article_id,product_code,prod_name,product_type_no,product_type_name,product_group_name,graphical_appearance_no,graphical_appearance_name,colour_group_code,colour_group_name,perceived_colour_value_id,perceived_colour_value_name,perceived_colour_master_id,perceived_colour_master_name,department_no,department_name,index_code,index_name,index_group_no,index_group_name,section_no,section_name,garment_group_no,garment_group_name,detail_desc
798779001,798779,Irma svettis,252,Sweater,Garment Upper body,1010008,Front print,11,Off White,1,Dusty Light,9,White,1636,Jersey fancy,A,Ladieswear,1,Ladieswear,15,Womens Everyday Collection,1005,Jersey Fancy,"Short, boxy top in soft sweatshirt fabric with a motif on the front, dropped shoulders, long, slightly wider sleeves and ribbing around the neckline, cuffs and hem. Soft brushed inside."
799336001,799336,Flirty Landala earring,70,Earring,Accessories,1010016,Solid,5,Gold,5,Bright,15,Metal,4345,Jewellery Extended,C,Ladies Accessories,1,Ladieswear,66,Womens Small accessories,1019,Accessories,"Large earrings with an asymmetric, textured metal disc at the top and long sparkly stone fringes. Length 10 cm."
799876001,799876,Tina Fluffy Fur,262,Jacket,Garment Upper body,1010016,Solid,32,Orange,1,Dusty Light,3,Orange,1244,Outdoor/Blazers,D,Divided,2,Divided,53,Divided Collection,1007,Outdoor,"Short, straight-cut coat in soft pile with large notch lapels, a concealed fastening with press-studs at the front and concealed pockets in the side seams. Lined."
800416003,800416,LAVA,252,Sweater,Garment Upper body,1010022,Jacquard,11,Off White,1,Dusty Light,9,White,6526,Baby Girl Knitwear,G,Baby Sizes 50-98,4,Baby/Children,40,Baby Girl,1003,Knitwear,"Jumper in double-layered, fine knit cotton with a button on one shoulder, long sleeves, a roll-edge neckline and narrow ribbing around the cuffs and hem."
800436012,800436,HULDA tie,265,Dress,Garment Full body,1010016,Solid,71,Light Blue,3,Light,2,Blue,6555,Baby Girl Woven,G,Baby Sizes 50-98,4,Baby/Children,40,Baby Girl,1006,Woven/Jersey/Knitted mix Baby,"Dress in an airy cotton weave with a rounded collar and button placket, long sleeves with narrow, buttoned cuffs, a seam at the waist with a tie detail, and a flared skirt. Unlined."
800447002,800447,Necklace Asap,77,Necklace,Accessories,1010016,Solid,5,Gold,5,Bright,15,Metal,9986,Small Accessories,F,Menswear,3,Menswear,25,Men Accessories,1019,Accessories,"Metal chain necklaces in various designs. Length approx. 55 cm, 65 cm and 75 cm."
800768002,800768,Nelly dress,254,Top,Garment Upper body,1010016,Solid,93,Dark Green,4,Dark,20,Khaki green,2033,Woven Tops,A,Ladieswear,1,Ladieswear,8,Mama,1010,Blouses,"Short dress in a crêpe weave with a round neckline and an opening with a button at the back of the neck. Smocked seam under the bust and long, wide sleeves with smocking and a small frill trim at the cuffs. Unlined."
800826007,800826,Molko Treggings,272,Trousers,Garment Lower body,1010016,Solid,61,Light Purple,3,Light,6,Lilac Purple,7617,Kids Girl Trouser,H,Children Sizes 92-140,4,Baby/Children,76,Kids Girl,1009,Trousers,"Treggings in stretch twill with a small glittery heart at the top, an elasticated waist, a fake fly and fake front pockets."
800863001,800863,Fake hair,72,Hair clip,Accessories,1010016,Solid,61,Light Purple,3,Light,4,Pink,4313,Girls Small Acc/Bags,J,"Children Accessories, Swimwear",4,Baby/Children,43,"Kids Accessories, Swimwear & D",1019,Accessories,"Glittery hair clip with long, curly hair extensions. Length approx. 40 cm."
800976001,800976,LS Pearl Jam,265,Dress,Garment Full body,1010016,Solid,9,Black,4,Dark,5,Black,2033,Woven Tops,A,Ladieswear,1,Ladieswear,8,Mama,1010,Blouses,"Knee-length dress in a viscose crêpe weave with a V-neck, buttons down the front and long sleeves with gathers at the shoulders. Seam under the bust with elastication at the back and a gently flared skirt. Unlined."
801166005,801166,Jack Skinny Slack,272,Trousers,Garment Lower body,1010004,Check,9,Black,4,Dark,5,Black,5686,Trouser,F,Menswear,3,Menswear,20,Contemporary Smart,1009,Trousers,"Suit trousers in a stretch weave with a concealed hook-and-eye fastener and zip fly. Diagonal side pockets, jetted back pockets, and an adjustable tab with buttons at the sides. Skinny Fit – a fit with slightly shorter legs that is close-fitting at the thighs, knees and ankles to create a completely fitted silhouette."
801199001,801199,Anabelle Blouse,259,Shirt,Garment Upper body,1010016,Solid,17,Yellowish Brown,2,Medium Dusty,13,Brown,2033,Woven Tops,A,Ladieswear,1,Ladieswear,8,Mama,1010,Blouses,"Wide blouse in a crêpe weave with a stand-up collar and V-neck with ties at the front. Wide, 3/4-length balloon sleeves, a gathered seam under the bust and a flared lower section."
801208001,801208,HENRI MOCKNECK BLOUSE,254,Top,Garment Upper body,1010016,Solid,9,Black,4,Dark,5,Black,1660,Jersey,A,Ladieswear,1,Ladieswear,6,Womens Casual,1005,Jersey Fancy,"Straight-style blouse in airy, softly draping, textured-knit jersey with a stand-up collar and cut-out section at the back with ties at the back of the neck. Long, raglan balloon sleeves with narrow, concealed elastication at the cuffs."
801428018,801428,Niclas Jogger (TVP),272,Trousers,Garment Lower body,1010016,Solid,73,Dark Blue,2,Medium Dusty,2,Blue,7656,Kids Boy Trouser,H,Children Sizes 92-140,4,Baby/Children,46,Kids Boy,1009,Trousers,"Joggers in lightweight, washed cotton twill with covered elastication and a drawstring at the waist, a fake fly and side pockets. Tapered legs with covered elastication at the hems."
801429003,801429,Dayton chinos,272,Trousers,Garment Lower body,1010016,Solid,9,Black,4,Dark,5,Black,7656,Kids Boy Trouser,H,Children Sizes 92-140,4,Baby/Children,46,Kids Boy,1009,Trousers,"Chinos in stretch cotton twill with an adjustable, elasticated waist, zip fly and button, and tapered legs. Decorative coin pocket, diagonal side pockets and fake jetted back pockets."
801443005,801443,David supersoft stretch 5-Pkt,272,Trousers,Garment Lower body,1010016,Solid,7,Grey,2,Medium Dusty,12,Grey,7656,Kids Boy Trouser,H,Children Sizes 92-140,4,Baby/Children,46,Kids Boy,1009,Trousers,"5-pocket trousers in stretch, supersoft twill with an adjustable, elasticated waist, zip fly and button and straight hems."
801512004,801512,BYRON ancle HW tights,273,Leggings/Tights,Garment Lower body,1010016,Solid,9,Black,4,Dark,5,Black,8310,Ladies Sport Bottoms,S,Sport,26,Sport,5,Ladies H&M Sport,1005,Jersey Fancy,"High-waisted, ankle-length running tights in fast-drying functional fabric. Wide panel at the waist containing a concealed key pocket."
801566002,801566,Clark slim blz,264,Blazer,Garment Upper body,1010016,Solid,73,Dark Blue,4,Dark,2,Blue,8615,Blazer S&T,F,Menswear,3,Menswear,23,Men Suits & Tailoring,1008,Dressed,"Single-breasted jacket in a stretch wool weave with narrow notch lapels, a chest pocket, flap front pockets and three inner pockets, one with a button. Two buttons at the front, decorative buttons at the cuffs and a single back vent. Lined. Slim Fit – a fit that shapes in at the chest and tapers at the waist. This, combined with slightly narrower sleeves, creates a fitted silhouette."
801673002,801673,Yasmine LS,254,Top,Garment Upper body,1010016,Solid,10,White,3,Light,9,White,1643,Basic 1,D,Divided,2,Divided,51,Divided Basics,1002,Jersey Basic,"Fitted top in soft cotton jersey with a V-neck, gathered seam at the front and long sleeves."
801732004,801732,Shanghai Chino Trousers,272,Trousers,Garment Lower body,1010016,Solid,61,Light Purple,3,Light,6,Lilac Purple,7617,Kids Girl Trouser,H,Children Sizes 92-140,4,Baby/Children,76,Kids Girl,1009,Trousers,"Calf-length, pull-on trousers in a cotton weave. Regular, elasticated waist with a frill trim at the top and decorative bow at the front. Small embroidered motif below the waistband, a fake fly, side pockets and gently tapered legs."
801738002,801738,Holly 2pack,272,Trousers,Garment Lower body,1010001,All over pattern,9,Black,4,Dark,5,Black,7617,Kids Girl Trouser,H,Children Sizes 92-140,4,Baby/Children,76,Kids Girl,1009,Trousers,"Trousers in an airy viscose weave with elastication and a decorative bow at the waist, side pockets and tapered legs with elasticated hems."
801803004,801803,Henry Belt Shorts,274,Shorts,Garment Lower body,1010001,All over pattern,12,Light Beige,1,Dusty Light,11,Beige,7617,Kids Girl Trouser,H,Children Sizes 92-140,4,Baby/Children,76,Kids Girl,1009,Trousers,"Shorts in an airy cotton weave with an adjustable, elasticated waist, pleats at the front and detachable, soft tie belt. Fake fly with a press-stud, side pockets and fake welt back pockets."
801856003,801856,SB Bobby TP,262,Jacket,Garment Upper body,1010016,Solid,22,Yellow,7,Medium,8,Yellow,7852,Kids Boy Outdoor,H,Children Sizes 92-140,4,Baby/Children,45,Kids Outerwear,1007,Outdoor,"Nylon jacket with a detachable, jersey-lined hood, zip down the front with a chin guard, zipped side pockets and ribbing at the cuffs and hem. Jersey lining."
801906001,801906,TOM CHINO 2-p,274,Shorts,Garment Lower body,1010016,Solid,22,Yellow,7,Medium,8,Yellow,7655,Kids Boy Shorts,H,Children Sizes 92-140,4,Baby/Children,46,Kids Boy,1025,Shorts,"Shorts in a soft cotton weave with an adjustable elasticated waist, zip fly and button, side pockets and a fake welt back pocket."
802030002,802030,Cleo shirtdress,265,Dress,Garment Full body,1010024,Chambray,72,Blue,2,Medium Dusty,2,Blue,7613,Kids Girl Dresses,H,Children Sizes 92-140,4,Baby/Children,76,Kids Girl,1014,Dresses/Skirts girls,"Shirt dress in a soft cotton weave with a collar and button placket. Long sleeves with a tab and button, side pockets and a detachable, braided belt in imitation suede at the waist. Unlined."
802077005,802077,ANDY FANCY,255,T-shirt,Garment Upper body,1010001,All over pattern,13,Beige,1,Dusty Light,1,Mole,7648,Kids Boy Jersey Fancy,H,Children Sizes 92-140,4,Baby/Children,46,Kids Boy,1005,Jersey Fancy,"Long-sleeved top in soft, printed cotton jersey."
802230001,802230,Karin rib,306,Bra,Underwear,1010026,Other structure,9,Black,4,Dark,5,Black,8316,Ladies Sport Bras,S,Sport,26,Sport,5,Ladies H&M Sport,1005,Jersey Fancy,"Sports bra in ribbed, fast-drying functional fabric with a racer back and wide elastic at the hem. Lined at the front. Medium support."
802230003,802230,Karin rib,306,Bra,Underwear,1010016,Solid,51,Light Pink,1,Dusty Light,4,Pink,8316,Ladies Sport Bras,S,Sport,26,Sport,5,Ladies H&M Sport,1005,Jersey Fancy,"Sports bra in ribbed, fast-drying functional fabric with a racer back and wide elastic at the hem. Lined at the front. Medium support."
802557001,802557,PQ HARRY ALPACA HOODIE,252,Sweater,Garment Upper body,1010016,Solid,9,Black,4,Dark,5,Black,1612,Jersey/Knitwear Premium,A,Ladieswear,1,Ladieswear,14,Womens Premium,1003,Knitwear,"Jumper knitted in a soft wool blend containing some alpaca with a wrapover hood, low dropped shoulders, long dolman sleeves and a wide elasticated knit trim at the hem."
802559004,802559,Garbi,275,Skirt,Garment Lower body,1010016,Solid,43,Dark Red,4,Dark,18,Red,1422,Skirt,A,Ladieswear,1,Ladieswear,15,Womens Everyday Collection,1012,Skirts,"Knee-length A-line skirt in imitation leather. High waist with press-studs and a concealed zip at one side, and decorative seams front and back. Unlined."
802568002,802568,PQ TAS TOP,252,Sweater,Garment Upper body,1010016,Solid,92,Green,1,Dusty Light,20,Khaki green,1612,Jersey/Knitwear Premium,A,Ladieswear,1,Ladieswear,14,Womens Premium,1003,Knitwear,"Fitted jumper in soft, fine, rib-knit wool containing some cashmere with hole-knit details at the front, extra-long sleeves and ribbing around the neckline."
802881001,802881,Moss PU biker,262,Jacket,Garment Upper body,1010016,Solid,9,Black,4,Dark,5,Black,1244,Outdoor/Blazers,D,Divided,2,Divided,53,Divided Collection,1007,Outdoor,Biker jacket in grained imitation leather with a diagonal zip down the front and a collar with decorative press-studs. Zipped side pockets and long sleeves with a zip at the cuffs. Lined.
803118002,803118,Heart,265,Dress,Garment Full body,1010016,Solid,43,Dark Red,4,Dark,18,Red,3708,Loungewear,A,Ladieswear,1,Ladieswear,62,"Womens Nightwear, Socks & Tigh",1017,"Under-, Nightwear","Short dress in a soft, fine knit with a ribbed turtle neck, long sleeves and a flared skirt."
803173003,803173,OL Dog Lollo Knitted,231,Dog Wear,Accessories,1010016,Solid,7,Grey,4,Dark,12,Grey,3419,Other items,C,Ladies Accessories,1,Ladieswear,66,Womens Small accessories,1019,Accessories,"Dog jumper in a soft fine knit containing some wool. Polo neck, ribbing around the front legs and an opening for the back legs."
803182001,803182,OL Dog Owe Knitted,231,Dog Wear,Accessories,1010016,Solid,6,Light Grey,1,Dusty Light,12,Grey,3419,Other items,C,Ladies Accessories,1,Ladieswear,66,Womens Small accessories,1019,Accessories,Dog jumper in a soft cable knit with a ribbed collar and ribbing around the front legs and back.
803290002,803290,Cersei Utility Parka,262,Jacket,Garment Upper body,1010016,Solid,19,Greenish Khaki,2,Medium Dusty,20,Khaki green,1244,Outdoor/Blazers,D,Divided,2,Divided,53,Divided Collection,1007,Outdoor,"Jacket in a cotton weave with a collar, concealed buttons down the front and a yoke at the back. Flap chest pockets with a button, diagonal front pockets and buttoned cuffs. Unlined."
803315003,803315,Ronni top,253,Vest top,Garment Upper body,1010016,Solid,23,Dark Yellow,7,Medium,3,Orange,1648,Knitwear,A,Ladieswear,1,Ladieswear,18,Womens Trend,1003,Knitwear,"Fitted, sleeveless, polo-neck top in a ribbed knit with a slight sheen."
803575001,803575,LOVE SUNNIES,81,Sunglasses,Accessories,1010016,Solid,9,Black,4,Dark,5,Black,3946,Small Accessories,D,Divided,2,Divided,52,Divided Accessories,1019,Accessories,"Heart-shaped sunglasses with slim metal and plastic frames, adjustable nose pads and tinted, UV-protective lenses."
803614004,803614,BB Nicko windbreaker TP,262,Jacket,Garment Upper body,1010001,All over pattern,10,White,3,Light,9,White,8852,Young Boy Outdoor,I,Children Sizes 134-170,4,Baby/Children,45,Kids Outerwear,1007,Outdoor,"Block-coloured windbreaker in woven fabric with a high collar and lined, detachable hood with a hook and loop strap. Zip down the front with a chin guard, welt side pockets with a hook and loop fastening, and narrow elastication at the cuffs and hem. Lined."
803625002,803625,Griswold,94,Sneakers,Shoes,1010016,Solid,9,Black,4,Dark,5,Black,3828,Sneakers,C,Ladies Accessories,1,Ladieswear,64,Womens Shoes,1020,Shoes,"Trainers in mesh and imitation leather with a padded edge, lacing at the front and a loop at the back. Jersey linings, mesh insoles and chunky soles."
803867002,803867,Lip balm 3D,98,Fine cosmetics,Cosmetic,1010016,Solid,10,White,3,Light,9,White,4313,Girls Small Acc/Bags,J,"Children Accessories, Swimwear",4,Baby/Children,43,"Kids Accessories, Swimwear & D",1019,Accessories,Strawberry-flavoured lip balm in a unicorn-shaped pot. 5 g. Not for children under 3.
803949001,803949,MICHELLE SHIRT,259,Shirt,Garment Upper body,1010016,Solid,19,Greenish Khaki,2,Medium Dusty,20,Khaki green,1543,Tops Woven,D,Divided,2,Divided,53,Divided Collection,1010,Blouses,"Straight-cut shirt in an airy viscose weave with a collar, V-neck opening and buttons down the front. Flap chest pockets, 3/4-length, cuffed sleeves and short slits in the sides."
803969001,803969,Inga bikini shopbasket 7pk,286,Underwear bottom,Underwear,1010016,Solid,43,Dark Red,4,Dark,18,Red,1334,Casual Lingerie,B,Lingeries/Tights,1,Ladieswear,61,Womens Lingerie,1017,"Under-, Nightwear","Bikini briefs in cotton jersey with a mid waist, lined gusset and medium coverage at the back."
803971004,803971,Lush Vest,261,Outdoor Waistcoat,Garment Upper body,1010001,All over pattern,11,Off White,1,Dusty Light,9,White,7812,Kids Girl Outdoor,H,Children Sizes 92-140,4,Baby/Children,45,Kids Outerwear,1007,Outdoor,"Padded gilet in a quilted weave with a detachable, lined hood and stand-up collar. Zip down the front with a round tab and chin guard, and side pockets. Slightly longer and rounded at the back. Lined."
803971006,803971,Lush Vest,261,Outdoor Waistcoat,Garment Upper body,1010016,Solid,73,Dark Blue,4,Dark,2,Blue,7812,Kids Girl Outdoor,H,Children Sizes 92-140,4,Baby/Children,45,Kids Outerwear,1007,Outdoor,"Padded gilet in a quilted weave with a detachable, lined hood and stand-up collar. Zip down the front with a round tab and chin guard, and side pockets. Slightly longer and rounded at the back. Lined."
804082001,804082,Cool Tuffssan earring,70,Earring,Accessories,1010016,Solid,5,Gold,5,Bright,15,Metal,4344,Jewellery,C,Ladies Accessories,1,Ladieswear,66,Womens Small accessories,1019,Accessories,Earrings in embossed metal with square pendants. Length approx. 4 cm.
804292001,804292,Dollar HW Tapered,272,Trousers,Garment Lower body,1010016,Solid,19,Greenish Khaki,4,Dark,20,Khaki green,1722,Trouser,A,Ladieswear,1,Ladieswear,15,Womens Everyday Collection,1009,Trousers,"Ankle-length trousers in twill made from a cotton blend. High paper bag waist with pleats and a detachable tie belt, a zip fly and buttons, diagonal side pockets with a decorative flap and button, and tapered legs."
804555006,804555,PQ CAT BEANIE,75,Hat/beanie,Accessories,1010010,Melange,72,Blue,7,Medium,2,Blue,1612,Jersey/Knitwear Premium,A,Ladieswear,1,Ladieswear,14,Womens Premium,1003,Knitwear,"Hat in soft, rib-knit cashmere with a wide, foldover hem."
804610001,804610,Allington TVP,255,T-shirt,Garment Upper body,1010016,Solid,10,White,3,Light,9,White,5831,Knitwear,F,Menswear,3,Menswear,23,Men Suits & Tailoring,1003,Knitwear,"Round-necked, straight-cut T-shirt in soft premium cotton jersey with narrow ribbing around the neckline."
804664003,804664,Kaizen Teddy,252,Sweater,Garment Upper body,1010005,Colour blocking,52,Pink,2,Medium Dusty,4,Pink,1640,Tops Fancy Jersey,D,Divided,2,Divided,53,Divided Collection,1005,Jersey Fancy,"Top in soft pile with a stand-up collar, zip at the top, dropped shoulders, long sleeves and ribbing at the cuffs and hem."
804664004,804664,Kaizen Teddy,252,Sweater,Garment Upper body,1010007,Embroidery,13,Beige,1,Dusty Light,11,Beige,1640,Tops Fancy Jersey,D,Divided,2,Divided,53,Divided Collection,1005,Jersey Fancy,"Top in soft pile with a stand-up collar, zip at the top, dropped shoulders, long sleeves and ribbing at the cuffs and hem."
804735006,804735,Long scarf scrunchie,78,Other accessories,Accessories,1010001,All over pattern,33,Dark Orange,4,Dark,3,Orange,4343,Hair Accessories,C,Ladies Accessories,1,Ladieswear,66,Womens Small accessories,1019,Accessories,Elasticated satin scrunchie with a scarf detail.
804735012,804735,Long scarf scrunchie,78,Other accessories,Accessories,1010001,All over pattern,33,Dark Orange,4,Dark,3,Orange,4343,Hair Accessories,C,Ladies Accessories,1,Ladieswear,66,Womens Small accessories,1019,Accessories,Elasticated satin scrunchie with a scarf detail.
804759018,804759,Gilda leggings,273,Leggings/Tights,Garment Lower body,1010001,All over pattern,9,Black,4,Dark,5,Black,8716,Young Girl Jersey Fancy,I,Children Sizes 134-170,4,Baby/Children,77,Young Girl,1005,Jersey Fancy,"Treggings in sturdy jersey with an elasticated waist, fake fly, fake front pockets and real back pockets."
805127004,805127,Morris strawhat,76,Hat/brim,Accessories,1010016,Solid,13,Beige,4,Dark,11,Beige,2950,Baby Toys/Acc,G,Baby Sizes 50-98,4,Baby/Children,44,Baby Essentials & Complements,1019,Accessories,Hat in braided paper straw with a band. Width of brim 3.5 cm.
805141001,805141,TD Springfloral,259,Shirt,Garment Upper body,1010001,All over pattern,9,Black,4,Dark,5,Black,5731,Shirt,F,Menswear,3,Menswear,23,Men Suits & Tailoring,1011,Shirts,"Shirt in an airy, patterned viscose and cotton weave with a turn-down collar, French front and yoke at the back. Long sleeves with adjustable buttoning at the cuffs, and a rounded hem. Slim Fit – a fit with narrow shoulders and a tapered waist for a fitted silhouette."
805356001,805356,ES OLIVIA DRESS,265,Dress,Garment Full body,1010016,Solid,42,Red,7,Medium,18,Red,8718,Young Girl Knitwear,I,Children Sizes 134-170,4,Baby/Children,77,Young Girl,1003,Knitwear,"Gently flared dress in a soft, fine knit containing glittery threads with a decorative bow at the neckline and short sleeves."
805370003,805370,Tuxedo leggings,273,Leggings/Tights,Garment Lower body,1010016,Solid,9,Black,4,Dark,5,Black,8716,Young Girl Jersey Fancy,I,Children Sizes 134-170,4,Baby/Children,77,Young Girl,1005,Jersey Fancy,Leggings in soft cotton jersey with covered elastication at the waist.
805510028,805510,AMY PRINTED TSHIRT,255,T-shirt,Garment Upper body,1010008,Front print,10,White,3,Light,9,White,1660,Jersey,A,Ladieswear,1,Ladieswear,6,Womens Casual,1005,Jersey Fancy,Round-necked T-shirt in soft cotton jersey.
805683001,805683,Glitter Beanie,75,Hat/beanie,Accessories,1010009,Glittering/Metallic,9,Black,4,Dark,5,Black,3945,Knit & Woven,D,Divided,2,Divided,52,Divided Accessories,1019,Accessories,Hat in a soft rib knit decorated with sequins. Sewn-in turn-up at the hem.
805707003,805707,SOLENE SHORTS,274,Shorts,Garment Lower body,1010018,Treatment,73,Dark Blue,2,Medium Dusty,2,Blue,8716,Young Girl Jersey Fancy,I,Children Sizes 134-170,4,Baby/Children,77,Young Girl,1005,Jersey Fancy,"Shorts in stretch, denim-look jersey made from a cotton blend with an elasticated waist, fake front pockets, real back pockets and sewn-in turn-ups at the hems."
805708004,805708,KAYLA SHORTS,274,Shorts,Garment Lower body,1010014,Placement print,20,Other Yellow,5,Bright,8,Yellow,8716,Young Girl Jersey Fancy,I,Children Sizes 134-170,4,Baby/Children,77,Young Girl,1005,Jersey Fancy,"Shorts in printed lightweight sweatshirt fabric with an elasticated, drawstring waist, side pockets and sewn-in turn-ups at the hems."
805709002,805709,Flygare top,255,T-shirt,Garment Upper body,1010008,Front print,10,White,3,Light,9,White,8716,Young Girl Jersey Fancy,I,Children Sizes 134-170,4,Baby/Children,77,Young Girl,1005,Jersey Fancy,"Wide, cropped T-shirt in soft, printed jersey with dropped shoulders, wide sleeves and ribbing around the neckline."
805714002,805714,IRIS PRICE HOOD,252,Sweater,Garment Upper body,1010008,Front print,22,Yellow,7,Medium,8,Yellow,8716,Young Girl Jersey Fancy,I,Children Sizes 134-170,4,Baby/Children,77,Young Girl,1005,Jersey Fancy,"Boxy-style hooded top in soft, cotton sweatshirt fabric with a print motif. Dropped shoulders, long sleeves, ribbing at the cuffs and a drawstring at the hem. Soft brushed inside."
805770002,805770,Marguerite top,254,Top,Garment Upper body,1010016,Solid,51,Light Pink,1,Dusty Light,4,Pink,1636,Jersey fancy,A,Ladieswear,1,Ladieswear,15,Womens Everyday Collection,1005,Jersey Fancy,"Fitted top in soft, ribbed jersey with a round neck and short puff sleeves."
805778002,805778,Lucas Linen SS shirt,259,Shirt,Garment Upper body,1010016,Solid,17,Yellowish Brown,2,Medium Dusty,13,Brown,5777,Shirt,F,Menswear,3,Menswear,20,Contemporary Smart,1011,Shirts,"Short-sleeved shirt in a linen and cotton weave with a concealed button-down collar and classic front. Open chest pocket, yoke with a pleat at the back, and a rounded hem. Slim Fit – a fit with narrow shoulders and a tapered waist for a fitted silhouette."
805941002,805941,DHANI lowprice clamdiggers,274,Shorts,Garment Lower body,1010016,Solid,83,Dark Turquoise,2,Medium Dusty,19,Green,7655,Kids Boy Shorts,H,Children Sizes 92-140,4,Baby/Children,46,Kids Boy,1025,Shorts,"Knee-length shorts in a cotton weave with an elasticated, drawstring waist and patch front pockets."
806000015,806000,VILDE 2P SS TVP,255,T-shirt,Garment Upper body,1010001,All over pattern,12,Light Beige,1,Dusty Light,11,Beige,6545,Baby Boy Jersey Fancy,G,Baby Sizes 50-98,4,Baby/Children,41,Baby Boy,1005,Jersey Fancy,T-shirts in soft cotton jersey with a press-stud on one shoulder (except in sizes 1½-4Y).
806071003,806071,Piti PQ loafer,144,Flat shoe,Shoes,1010016,Solid,22,Yellow,7,Medium,8,Yellow,3040,Premium Quality,C,Ladies Accessories,1,Ladieswear,64,Womens Shoes,1020,Shoes,Loafers in suede with pointed toes and tassels at the front. Leather linings and insoles. Heel 0.5 cm.
806141001,806141,Schnauzer jumpsuit S/L,267,Jumpsuit/Playsuit,Garment Full body,1010001,All over pattern,73,Dark Blue,4,Dark,2,Blue,7616,Kids Girl Jersey Fancy,H,Children Sizes 92-140,4,Baby/Children,76,Kids Girl,1005,Jersey Fancy,"Sleeveless playsuit in printed cotton jersey with a narrow, elasticated seam and decorative bow at the waist, and small frill trim at the hems."
806166001,806166,Amelia swettis L/S,252,Sweater,Garment Upper body,1010001,All over pattern,52,Pink,2,Medium Dusty,4,Pink,7616,Kids Girl Jersey Fancy,H,Children Sizes 92-140,4,Baby/Children,76,Kids Girl,1005,Jersey Fancy,Long-sleeved top in lightweight cotton sweatshirt fabric with ribbing around the neckline and cuffs.
806179001,806179,Alice tanktop,253,Vest top,Garment Upper body,1010001,All over pattern,52,Pink,7,Medium,4,Pink,7616,Kids Girl Jersey Fancy,H,Children Sizes 92-140,4,Baby/Children,76,Kids Girl,1005,Jersey Fancy,"Top in soft, patterned cotton jersey with decorative gathers at the top of the front and narrow shoulder straps with a decorative bow."
806183006,806183,Meadow trs,272,Trousers,Garment Lower body,1010001,All over pattern,22,Yellow,7,Medium,8,Yellow,7616,Kids Girl Jersey Fancy,H,Children Sizes 92-140,4,Baby/Children,76,Kids Girl,1005,Jersey Fancy,"Treggings in sturdy cotton jersey with covered elastication at the waist, a fake fly, fake front pockets and real back pockets."
806199002,806199,Ciara fancy hood,308,Hoodie,Garment Upper body,1010015,Sequin,73,Dark Blue,4,Dark,2,Blue,7616,Kids Girl Jersey Fancy,H,Children Sizes 92-140,4,Baby/Children,76,Kids Girl,1005,Jersey Fancy,"Long-sleeved top in soft sweatshirt fabric with a motif, jersey-lined wrapover hood, and ribbing at the cuffs and hem. Soft brushed inside."
