article_id,prod_name,product_type_name,product_group_name,colour_group_name,detail_desc
751429005,LEGGINGS BELLE,Trousers,Garment Lower body,Grey,Leggings in soft, stretch denim with an elasticated waist, fake fly, fake front pockets and real back pockets.
751471021,Pluto RW slacks (1),Trousers,Garment Lower body,Light Beige,Ankle-length cigarette trousers in a stretch weave with a zip fly, concealed hook-and-eye fastening, and regular waist with concealed elastication. Side pockets, fake back pockets and tapered legs.
751530003,Strawberry HW pullon,Shorts,Garment Lower body,Light Beige,Short shorts in a viscose and linen weave with a high, elasticated waist, small frill trim at the top, large patch pockets at the sides and wide legs.
751557002,Moss biker jacket,Jacket,Garment Upper body,Black,Biker jacket with a diagonal zip down the front and a collar with decorative press-studs. Zipped side pockets and long sleeves with a zip at the cuffs. Lined.
751559013,SKINNY FANCY,Trousers,Garment Lower body,Black,Slim-fit, ankle-length jeans in washed, stretch denim with an adjustable elasticated waist (in sizes 8-12Y), and a zip fly and button. Coin pocket, fake front pockets, real back pockets and narrow hems.
751592004,Astrid shirt,Shirt,Garment Upper body,Dark Blue,Shirt in an airy cotton weave with a collar, buttons down the front and an open chest pocket. Long sleeves with buttoned cuffs, and a gently rounded hem.
751593002,Lorentzo flannel shirt,Shirt,Garment Upper body,White,Shirt in soft, lightweight cotton flannel with a collar and buttons down the front. Dropped shoulders, long sleeves with buttoned cuffs, an open chest pocket and a rounded hem. Slightly longer at the back.
751664001,Space 5 pkt RW tregging,Trousers,Garment Lower body,Black,Treggings in superstretch twill with an elasticated waist, fake front pockets, real back pockets and skinny legs.
751994003,Slim 5pkt Midprice,Trousers,Garment Lower body,Light Blue,5-pocket jeans in washed denim with a regular waist, zip fly and slim legs.
751998001,Melrose 1,Shirt,Garment Upper body,White,Shirt in an airy cotton weave with a collar, buttons down the front and a yoke with a pleat at the back. Chest pocket, long sleeves with buttoned cuffs, and a gently rounded hem. Longer at the back.
752020001,Lilly tank,Top,Garment Upper body,Light Beige,Vest top in a soft, ribbed viscose blend.
752036001,CNY Alix blouse TR,Blouse,Garment Upper body,Light Beige,Blouse in a softly draping jacquard weave with a slight sheen. Frilled stand-up collar and long puff sleeves with frill-trimmed, buttoned cuffs. Concealed button at the back of the neck and a concealed zip at the back.
752072006,Yolo Zip LS,Sweater,Garment Upper body,Other Yellow,Fitted jumper in a soft, rib knit with a turtle neck, visible zip at the top and long sleeves.
752090001,Mama Basic Pack,Garment Set,Garment Full body,Black,Set with a strappy top, top and pair of leggings in soft cotton jersey. Strappy top with a V-neck and narrow shoulder straps. Top with short sleeves. Both with gathers at the sides for best fit over the tummy. Leggings with a wide waist panel.
752413001,Sky ss dress set,Garment Set,Garment Full body,Light Beige,Set with a short-sleeved top, pair of leggings, dungaree dress and hairband in soft cotton jersey. Top with a concealed press-stud on one shoulder. Leggings with an elasticated waist. Dress with press-studs at the back, straps with a decorative tie detail at the front and patch pockets. Hairband with a twisted detail.
752471004,Castle maxi dress,Dress,Garment Full body,Black,Ankle-length dress in a crinkled viscose weave with a low neckline front and back and narrow shoulder straps. Seam at the waist, a narrow, detachable tie belt with tassels, and high slits in the sides. Unlined.
752486006,Bayonne long dress,Dress,Garment Full body,Yellow,Ankle-length dress in a cotton weave with lace details, a V-neck, narrow adjustable shoulder straps and a concealed zip at the back. Seam under the bust with pleats and a lace trim, and a seam at the hem with a lace trim and wide, pleated flounce. Lined bodice and a short inner skirt.
752657007,Fiffi folded waist,Leggings/Tights,Garment Lower body,Grey,Leggings in soft cotton and viscose jersey with a wide, foldover panel at the waist for a more comfortable fit.
752719002,COCO VP5,T-shirt,Garment Upper body,Light Orange,Short-sleeved top in soft, printed jersey with a round neck and flared, asymmetric hem. The top is made from recycled polyester.
752742013,Printed Tank 6.99:-,Vest top,Garment Upper body,Black,Vest top in cotton jersey with a print motif and slits in the sides of the hem.
752869001,MAGIC GLOVES,Gloves,Accessories,Black,Gloves in a soft, fine knit with ribbed cuffs. The tops of the thumb and index finger are in touchscreen-compatible material.
753006001,RECOMA reflective jacket,Jacket,Garment Upper body,Black,Popover running jacket in fast-drying functional fabric with reflective details, a hood and a zip at the top with a chin guard. Partially loose yoke at the back. long sleeves with ribbing and thumbholes at the cuffs, and a rounded, drawstring hem. Slightly longer at the back. Partly lined in mesh.
753007001,STAR anorak,Jacket,Garment Upper body,Black,Popover jacket in close-fitting jersey with padded sections in woven fabric, a padded hood and a wind flap at the top with press-studs. Tunnel pocket at the front and long sleeves with thumbholes. Lined. Polyester filling.
753085001,NOAH interactive hood TP,Hoodie,Garment Upper body,Grey,Top in soft sweatshirt fabric with an interactive appliqué on the front and jersey-lined, wrapover hood. Gently dropped shoulders, long sleeves and ribbing at the cuffs and hem. Soft brushed inside.
753278001,Anna Tube,Scarf,Accessories,Black,Tube scarf in an airy weave.
753294001,Julius waterproof HT BB,Sneakers,Shoes,Black,Waterproof hi-top trainers in imitation leather and mesh with a hook and loop tab and elasticated lacing at the front, and a loop front and back. Mesh linings and insoles. The trainers have a water-repellent coating without fluorocarbons.
753380003,SB Nicholas water resi Ski Jkt,Jacket,Garment Upper body,Other Yellow,Padded ski jacket in wind- and waterproof, breathable functional fabric with closed seams. Detachable, lined hood, zip down the front with a chin guard, a chest pocket, a sleeve pocket and zipped side pockets. Adjustable hook and loop tab at the cuffs and a snow flap with press-studs at the waist. Fleece lining. The jacket has a water-repellent coating without fluorocarbons.
753746002,ALINA jogger,Trousers,Garment Lower body,Light Grey,Joggers in soft sweatshirt fabric with covered elastication and a drawstring at the waist, diagonal side pockets and gently tapered legs with elasticated hems. Brushed inside.
753802007,Sacramento midi dress w,Dress,Garment Full body,Black,Calf-length dress in a crêpe weave with a V-neck, narrow adjustable shoulder straps, buttons down the front and two slits at the front.
754004001,Flirty Polly mix pk,Ring,Accessories,Gold,Metal jewellery set with two pairs of studs, two pairs of earrings and six rings.
754005002,Missy sneaker,Sneakers,Shoes,Beige,Trainers with elastic gores in the sides. Jersey linings and insoles and thermoplastic rubber (TPR) soles.
754005010,missy sneaker(1),Sneakers,Shoes,Light Blue,Trainers with elastic gores in the sides. Jersey linings and insoles and thermoplastic rubber (TPR) soles.
754056001,2P KAYLA SHORTS,Shorts,Garment Lower body,Black,Shorts in lightweight sweatshirt fabric with a print motif. Ribbed, elasticated drawstring waist and contrasting colour trims down the sides and at the hems.
754136001,DIV Jersey blazer (1),Blazer,Garment Upper body,Yellow,Straight-cut jacket in soft jersey with long notch lapels, jetted front pockets and 3/4-length sleeves with sewn-in turn-ups. No fasteners. Unlined.
754238001,Karin padded sport bra,Top,Garment Upper body,Black,Sports bra in fast-drying functional fabric. Lined front with removable inserts, a racer back and a wide elasticated hem. Extra firm support.
754413005,Bess tee,T-shirt,Garment Upper body,Dark Yellow,Short, fitted top in ribbed jersey with an angular neckline and short sleeves.
754492002,Vegas woven shorts,Shorts,Garment Lower body,Greenish Khaki,Short shorts in airy Tencel™ lyocell twill with an elasticated drawstring waist and side pockets.
754598005,TP ANDREW sweatpant SB,Trousers,Garment Lower body,Black,Joggers in sweatshirt fabric made from a cotton blend with an elasticated drawstring waist and side pockets. Narrow, decorative piping down the legs and ribbed hems. Soft brushed inside.
754697019,Herbal Hood- TVP,Hoodie,Garment Upper body,Black,Short, boxy top in sweatshirt fabric with a lined drawstring hood, dropped shoulders, long sleeves and ribbing at the cuffs and hem. Soft brushed inside.
754751013,Paris glove,Gloves,Accessories,Dark Red,Gloves in soft leather with a soft, fine-knit lining.
754921001,Agneta sunglasses,Sunglasses,Accessories,Yellowish Brown,Sunglasses with plastic frames and UV-protective, tinted lenses.
755119002,POW Reallove wedding dress,Dress,Garment Full body,Off White,Long dress with a bodice in lace and skirt in an airy weave. Scalloped V-neck with support panels at the top, an opening with a covered button at the back of the neck and a concealed zip at the back. Long sleeves with scalloped cuffs, a seam at the waist with a grosgrain band, and a gently flared skirt. Lined.
755356001,RUBBER ANIMALS,Accessories set,Accessories,Other Green,Small, glow-in-the-dark plastic toy dinosaurs in various sizes and designs. Size approx. 3x5 cm.
755360001,Marianne,Jacket,Garment Upper body,Black,Double-breasted, fitted jacket in felted fabric with a high stand-up collar, decorative stitching front and back, side pockets and a decorative tab at the cuffs. Lined.
755362003,Marita,Jacket,Garment Upper body,Dark Beige,Knee-length coat in bouclé yarn with wide notch lapels, concealed press-studs down the front, a tie belt at the waist, and a single back vent. Lined.
755467001,Henric fargo wireless push,Bra,Underwear,Black,Soft, non-wired bra in mesh and satin with padded cups for a larger bust and fuller cleavage. Adjustable shoulder straps and a hook-and-eye fastening at the back.
755473002,Shorts Straight Jogger,Shorts,Garment Lower body,Light Blue,5-pocket shorts in soft, stretch denim with a concealed drawstring at the waist, zip fly and button and straight legs.
755474001,Shorts Skinny Tech Stretch,Shorts,Garment Lower body,Blue,5-pocket shorts in denim with ultra-flexible stretch that keeps them in shape while providing full movement and optimum comfort. Regular waist, zip fly and button, and skinny legs with turn-ups at the hems.
755561001,Sassa blouse,Shirt,Garment Upper body,Light Pink,Blouse in a patterned viscose weave with pin-tucks at the top, a gathered yoke at the back and buttons down the front. Long sleeves with elasticated cuffs, and a rounded hem.
755698003,SID hipster hat,Hat/beanie,Accessories,Orange,Baby Exclusive. Rib-knit hat in soft wool.
755712001,Sune slipover set,Shirt,Garment Upper body,White,Set with a shirt, sweater vest and bow tie or tie. Shirt in a cotton weave with a narrow turn-down collar, buttons down the front and long sleeves with buttoned cuffs. V-neck sweater vest in fine-knit cotton with ribbed trims. Pre-tied tie/bow tie with an adjustable elastic strap and plastic fastener at the back.
755712002,Sune slipover set,Shirt,Garment Upper body,Blue,Set with a shirt, sweater vest and bow tie or tie. Shirt in a cotton weave with a narrow turn-down collar, buttons down the front and long sleeves with buttoned cuffs. V-neck sweater vest in fine-knit cotton with ribbed trims. Pre-tied tie/bow tie with an adjustable elastic strap and plastic fastener at the back.
755761002,BRIE cold shoulder,Sweater,Garment Upper body,Light Pink,Off-the-shoulder jumper in soft, fine-knit cotton with narrow shoulder straps, long sleeves and ribbing around the top, cuffs and hem.
756118012,SUGARPUFF MUSCLE TEE,T-shirt,Garment Upper body,Dark Blue,T-shirt in soft cotton jersey with ribbing around the neckline. Muscle Fit – a fit designed to showcase the body’s physique with narrow shoulders and tapered sleeves to create a flattering silhouette.
756192001,Mel Drawstring Tee,Sweater,Garment Upper body,Red,Cropped, fitted, off-the-shoulder top in ribbed jersey with a drawstring down the front and short sleeves.
756204003,Turtle Clutch Bag,Bag,Accessories,Dark Orange,Sturdy clutch bag in imitation suede with a narrow, detachable metal chain shoulder strap and a flap with a round metal buckle and concealed press-stud. Lined. Size 6x15.5x27 cm.
756243001,Aston sweater,Sweater,Garment Upper body,Grey,Long-sleeved top in lightweight sweatshirt fabric with gently dropped shoulders, ribbing around the neckline and cuffs and a knot detail at the hem.
756320030,Lindsay Sl-set (W),Pyjama set,Nightwear,Dark Turquoise,Pyjama top and shorts in soft satin. V-neck cami top with adjustable spaghetti shoulder straps and lace at the top. Short shorts with narrow elastication at the waist and lace-trimmed hems.
756322009,Lindsay N-slip (W),Night gown,Nightwear,Black,Short satin nightslip with lace at the top, a V-neck and adjustable spaghetti shoulder straps.
756350002,Madrid off-shoulder dress,Dress,Garment Full body,Black,Short off-the-shoulder dress in a patterned weave with elastication at the top, a smocked bodice and short sleeves.
756480003,Lady Danger Balconette,Bikini top,Swimwear,Black,Strapless, lined balconette bikini top with underwired, padded cups that lift and shape the bust. Silicone trim at the top, detachable, adjustable shoulder straps, side support and a hook-and-eye fastening at the back.
756718004,Dungaree sets,Garment Set,Garment Full body,Dark Blue,Long-sleeved top in soft jersey and a pair of dungarees in organic cotton sweatshirt fabric. Dungarees with a kangaroo pocket, adjustable straps with a press-stud, and ribbed hems. Soft brushed inside.
757119003,Cutiepie 2pack,Trousers,Garment Lower body,Dark Pink,Pull-on trousers in a cotton weave. Elasticated waist with a decorative bow at the front, fake front pockets and elasticated hems.
757130004,Rodeo knot l/s,Top,Garment Upper body,Black,Long-sleeved top in soft jersey with a print motif on the front and ties at the hem.
757228001,NICE jkt fun,Jacket,Garment Upper body,Off White,Padded jacket in a glossy weave with a holographic pattern. Detachable, lined hood with embroidery and appliqués, a zip down the front with a chin guard, and side pockets. Narrow elastication at the cuffs and hem. Lined.
757298001,R-neck Honeycomb,Sweater,Garment Upper body,Light Beige,Long-sleeved pima cotton jumper in a textured knit with ribbing around the neckline, cuffs and hem.
757303011,HONEY seamless bra,Bra,Underwear,Dark Red,Sports bra in fast-drying functional fabric with jacquard-patterned details, removable inserts, adjustable shoulder straps that cross at the back and wide ribbing at the hem. Light support. The bra is designed with the minimum number of seams for a more comfortable fit and increased mobility.
757413001,CHILLY 2p leggings,Leggings/Tights,Garment Lower body,Light Turquoise,Baby Exclusive. Leggings in soft organic cotton jersey with an elasticated waist and fake fly with decorative buttons.
757613002,Lauren shorts (J),Pyjama bottom,Nightwear,Light Blue,Short shorts in soft, ribbed jersey with an elasticated drawstring waist and small frill trim at the hems.
757671007,Raspberry,Blouse,Garment Upper body,White,Short-sleeved blouse in a viscose crêpe weave with a round neckline and small opening with a concealed button at the back of the neck. Decorative gathers at the shoulders and along the yoke at the back.
757671008,Raspberry,Blouse,Garment Upper body,Light Beige,Short-sleeved blouse in a viscose crêpe weave with a round neckline and small opening with a concealed button at the back of the neck. Decorative gathers at the shoulders and along the yoke at the back.
757678002,STELLA Premium beanie,Hat/beanie,Accessories,Grey,Double-layered hat in fine-knit wool with a small imitation leather appliqué at the hem.
757683001,FUN knitted set 2-pcs,Hat/beanie,Accessories,Grey,Set with a fleece-lined hat and scarf in a soft jacquard knit containing glittery threads. Hat with ears and a decorative bow on top and ear flaps.
757700003,REBECCA sweater,Sweater,Garment Upper body,Yellow,Jumper in a soft, fine knit containing some wool with long raglan sleeves and a gently rounded hem. Ribbing around the neckline, cuffs and hem. Slightly longer at the back.
757726003,tag top,Vest top,Garment Upper body,Black,Fitted one-shoulder top in ribbed jersey with one shoulder strap.
757741005,Taho top,Vest top,Garment Upper body,Beige,Sleeveless, fitted top in ribbed jersey made from a viscose blend with a shaped neckline front and back.
757805015,Wow Rocky Tee 4.99:-,T-shirt,Garment Upper body,Dark Blue,T-shirt in soft cotton jersey with sewn-in turn-ups on the sleeves.
757810002,Larry LS Tee,T-shirt,Garment Upper body,Black,Long-sleeved top in soft cotton jersey with ribbed cuffs.
757872002,Essie dress,Dress,Garment Full body,Light Grey,Sleeveless dress in sequined tulle with a concealed zip at the back, seam at the waist and flared skirt in a double layer of tulle. Jersey lining.
757896001,Timeless Push Up Tie back Bra,Bikini top,Swimwear,Dark Green,Bikini top with underwired, moulded, padded cups for a larger bust and fuller cleavage. Ties at the back of the neck.
757908001,Bodil Poncho,Top,Garment Upper body,Light Grey,Poncho in a soft, fine knit with a diagonal neckline that creates a light draping effect over one shoulder. Length front and back approx. 95 cm.
757926001,Skinny H.W Ankle Festive,Trousers,Garment Lower body,Blue,Ankle-length jeans in washed, stretch denim with hard-worn details, a high waist, zip fly and button and super-skinny legs.
758034001,Ivory ch brazilian 5pk,Underwear bottom,Underwear,Black,Brazilian briefs in cotton jersey with lace trims, a low waist, lined gusset and high cut at the back.
758050001,LS Olivia Cheeky Tanga,Swimwear bottom,Swimwear,Light Beige,LOVE STORIES x H&M. Patterned bikini bottoms with an elasticated waist, overlocked frilled edges, narrow sides and a high-cut back. Lined.
758151001,LS Mila Shirt + Shorts Set,Sarong,Swimwear,Pink,LOVE STORIES x H&M. Pyjamas with a blouse and pair of shorts in a cotton weave. Blouse with a small stand-up collar and gathers and concealed press-studs at the top of the front. Long sleeves with narrow, buttoned cuffs. Shorts with an elasticated drawstring waist and frill trim at the hems.
758261002,GLORIA SWEATSHIRT,Sweater,Garment Upper body,Dark Blue,Top in soft sweatshirt fabric with a print motif and reversible sequins. Slightly wider neckline, long raglan sleeves and ribbing around the neckline, cuffs and hem. Soft brushed inside.
758262002,My Humps Cheeky Tanga,Swimwear bottom,Swimwear,Dark Red,Cheeky, bikini bottoms with a low, V-shaped waistband made of two wide elastic straps. Wide sides and a high cut at the back.
758353001,PE CATHARINE TROUSER,Trousers,Garment Lower body,Black,Trousers in a sturdy Tencel™ lyocell and silk weave with a sheen. High waist, concealed hook-and-eye fastening, zip fly, diagonal side pockets, a welt back pocket and gently tapered legs with creases.
758381002,Twist fancy,Heeled sandals,Shoes,White,Imitation leather sandals with a braided foot strap and an adjustable ankle strap with a metal buckle. Imitation leather insoles. Heel 5 cm.
758435002,RUGBY SHORTS,Shorts,Garment Lower body,Dark Blue,Shorts in printed lightweight sweatshirt fabric with an elasticated drawstring waist and sewn-in turn-ups at the hems.
758557003,Esther set,Hat/beanie,Accessories,Light Orange,Set with a hat and pair of mittens in a soft, cable-knit cotton blend. Hat with faux fur pompom on top and ear flaps with ties. Mittens (sizes 0-6 months without thumbs) with fold-down ribbing at the cuffs. Fleece lining.
758561003,Rock Fancy Relaxed Shorts,Shorts,Garment Lower body,Dark Blue,Shorts in cotton twill with an elasticated drawstring waist, fake fly, side pockets and a welt back pocket. Relaxed Fit.
759118004,SL Clifford heavy tee,T-shirt,Garment Upper body,Light Green,T-shirt in sturdy cotton jersey with a lightly brushed finish.
759156004,Brent ballerina,Ballerinas,Shoes,Yellow,Ballet pumps in imitation suede with open sides and heel straps with covered elastication. Satin linings, imitation leather insoles and fluted soles.
759437001,Brandon tall,Boots,Shoes,Black,Knee-high boots with a zip half way down the shaft. Fabric linings and insoles and patterned soles. Heel 9 cm.
759482001,EVA eyelet belt (W),Belt,Accessories,Black,Belt in imitation leather with eyelets and a buckle in metal. Width 2.5 cm.
759628003,Agnes blouse,Blouse,Garment Upper body,Black,Blouse in airy chiffon with 3/4-length sleeves and two flounces at the cuffs. Lined.
759811002,PULL ON LINED,Trousers,Garment Lower body,Dark Blue,Pull-on jeans in stretch denim with elastication and a small frill at the waist and fake front pockets. Loose fit with gently tapered legs. Patterned jersey lining.
759814011,Sky HW jogger,Trousers,Garment Lower body,Light Grey,Joggers in sweatshirt fabric with a high elasticated drawstring waist, side pockets and elasticated hems. Soft brushed inside.
759814020,Sky HW jogger,Trousers,Garment Lower body,Greenish Khaki,Joggers in sweatshirt fabric with a high elasticated drawstring waist, side pockets and elasticated hems. Soft brushed inside.
759814034,Sky HW jogger,Trousers,Garment Lower body,Light Yellow,Joggers in sweatshirt fabric with a high elasticated drawstring waist, side pockets and elasticated hems. Soft brushed inside.
759847005,Elba swimsuit,Swimsuit,Swimwear,Black,Fully lined, backless swimsuit with narrow, adjustable shoulder straps, a twisted detail at the front and a fastener at the back. Cut-out section at the waist.
759871035,Tilda tank,Vest top,Garment Upper body,Red,Cropped, fitted top in cotton jersey with narrow shoulder straps.
759904001,Saints Roll-neck,Sweater,Garment Upper body,White,Shorter, fitted jumper in a rib knit with a polo neck and long sleeves.
759996002,GUBBEN set,Garment Set,Garment Full body,Dark Grey,Set with a long-sleeved bodysuit and pair of dungarees in soft organic cotton jersey. Long-sleeved bodysuit with lapped shoulders and press-studs at the crotch. Dungarees with straps that fasten at the front and full feet.
760019002,LOGAN romper,Jumpsuit/Playsuit,Garment Full body,Red,Romper suit in soft organic cotton jersey with a text print on the front, diagonal fastening with press-studs down the front and down one leg and full feet with elasticated heels.
760024011,TP Axel anklesock SB 5-p,Socks,Socks & Tights,Black,Socks in a soft, fine-knit cotton blend with elasticated tops.
760024035,TP Axel anklesock SB 5-p,Socks,Socks & Tights,Black,Socks in a soft, fine-knit cotton blend with elasticated tops.
760084006,Victorville HW Pull-on TRS,Trousers,Garment Lower body,Dark Beige,Ankle-length trousers in cotton twill with a high, elasticated waist, side pockets, flap leg pockets and tapered legs with elastication at the hems.
760471001,BB Klas Fleece,Jacket,Garment Upper body,Black,Jacket in soft fleece with a stand-up collar, zip down the front with a chin guard, long raglan sleeves and taped trims at the cuffs and hem. Unlined.
760633001,Coin HW tapered,Trousers,Garment Lower body,Greenish Khaki,Ankle-length trousers in woven fabric with a high waist, tie belt and zip fly with a hook-and-eye fastening. Side pockets with a decorative flap and button, and slightly wider, tapered legs.
760636003,JOGGER LW,Trousers,Garment Lower body,Blue,Joggers in washed, supersoft denim with an elasticated drawstring waist, side pockets, a welt back pocket and tapered legs with seams at the knees.
760656003,Dungaree Shorts,Shorts,Garment Lower body,Black,Dungaree shorts in washed cotton denim with adjustable straps, a chest pocket, side pockets and back pockets. Buttons at the sides and sewn-in turn-ups at the hems.
760866004,Betty cardigan,Cardigan,Garment Upper body,Grey,Slightly boxy cardigan in a soft rib knit containing some wool. Long sleeves, short slits in the sides and no fasteners.
760876016,Scarf Cub Pattern,Scarf,Accessories,Dark Beige,Scarf in a soft weave with fringes along the short sides.
761204005,Slipper BENNY,Slippers,Shoes,Dark Red,Slippers in soft fabric with a bow at the front. Faux fur linings and insoles, and soft soles with anti-slip protectors.
761204006,Slipper BENNY,Slippers,Shoes,Light Pink,Slippers in soft fabric with a bow at the front. Faux fur linings and insoles, and soft soles with anti-slip protectors.
761328003,HERCULES TANK  CONCIOUS,Vest top,Garment Upper body,Black,Cropped top in a crinkled weave with decorative buttons at the front, narrow, tie-top shoulder straps and smocking at the top and hem. The polyester content of the top is recycled.
761340001,TURNER TANK,Vest top,Garment Upper body,Black,Cropped top in smocked cotton jersey with elastication at the top and overlocked edges at the top and bottom.
761347003,Bonina ss,Sweater,Garment Upper body,Black,Short top in airy, crinkled jersey with a V-neck, decorative buttons down the front and short, wide sleeves. Narrow, covered elastication and a tie detail at the hem.
761374001,Boys Capsule Shorts,Shorts,Garment Lower body,Dark Orange,Shorts in a Tencel™ lyocell and linen weave containing some cotton. Zip fly and button, side pockets and fake back pockets with a flap and button.
761406003,Emma Roll Neck,Sweater,Garment Upper body,White,Jumper in a soft knit with a ribbed polo neck, dropped shoulders, long sleeves and ribbing at the cuffs and hem. Slightly longer at the back.
