article_id,prod_name,product_type_name,product_group_name,colour_group_name,detail_desc
728445004,Dreams,Blouse,Garment Upper body,Light Pink,Blouse in a crêpe weave with a V-neck with a wide flounced trim that continues down the front, a gathered yoke at the back and long sleeves with buttoned cuffs. Lined.
728618001,DOTTY func polyester lining,Jacket,Garment Upper body,Dark Blue,Jacket in windproof, water-repellent, breathable fabric with a rounded collar and detachable, lined hood. Zip down the front with a chin guard, flap patch pockets with a press-stud at the front, and ribbing at the cuffs. Lined. The jacket has a water-repellent coating without fluorocarbons.
728738002,Luna low price linen,Trousers,Garment Lower body,Black,Suit trousers in a soft linen blend with a concealed hook-and-eye fastening and zip fly. Side pockets, jetted back pockets with a button and legs with creases. Slim Fit – a fit that is close-fitting at the thighs, knees and ankles to create a fitted silhouette.
728832002,ES DETROIT CALISTA SKIRT,Skirt,Garment Lower body,Light Pink,Bell-shaped skirt in a fine-knit viscose blend with an elasticated waist.
729318004,Bagira Push Melbourne,Bra,Underwear,Black,Push-up bra in lace and mesh with underwired, moulded, padded cups for a larger bust and fuller cleavage. Narrow, adjustable shoulder straps and a narrow hook-and-eye fastening at the back.
729381005,Baloo shorts TP,Shorts,Garment Lower body,Blue,Shorts in a cotton and linen weave with covered elastication and a drawstring at the waist, fake fly, side pockets and a fake welt back pocket.
729604001,Double denim jacket,Jacket,Garment Upper body,Light Blue,Longer jacket in soft, washed denim with a collar, buttons down the front, flap chest pockets with a button and side pockets. Detachable tie belt at the waist, buttoned cuffs and an adjustable tab at the sides of the hem. Unlined.
729928025,JESSY SKIRT S.2,Skirt,Garment Lower body,Black,Short skater skirt in sturdy jersey with an elasticated waist and visible zip at the back. Unlined.
730013005,Shorts Slim Midas Zip Fly,Shorts,Garment Lower body,Light Blue,5-pocket shorts in washed denim with a regular waist, zip fly and button, and slim legs with sewn-in turn-ups at the hems.
730125007,Lola tank,Vest top,Garment Upper body,Red,Top in a crêpe weave with narrow, adjustable shoulder straps and a scalloped edge and broderie anglaise at the top.
730295001,Lova Lace Top,Vest top,Garment Upper body,Black,Satin top with a V-neck, lace at the top, narrow, adjustable shoulder straps and slits in the sides.
730312002,SPEED - SOFIA,Sweater,Garment Upper body,Grey,Long-sleeved top in printed, lightweight organic cotton sweatshirt fabric with a glittery print on the front and ribbing around the neckline, cuffs and hem.
730365004,Pluto dress,Dress,Garment Full body,Off White,Calf-length dress in lightly crinkled jersey with a V-neck, short sleeves with narrow elastication at the ends and an elasticated seam at the waist. Decorative buttons at the top and classic buttons on the skirt. Unlined.
730454019,Valter l/l pj SB TP,Pyjama set,Nightwear,Dark Blue,Pyjamas in soft cotton jersey. Long-sleeved top. Bottoms with an elasticated waist.
730471001,NB PLATON,Garment Set,Garment Full body,White,Bodysuit and a pair of leggings in organic cotton. Long-sleeved jersey bodysuit with a narrow frill trim around the neckline and press-studs at the shoulders and crotch. Ribbed, fine-knit leggings with an elasticated waist and frill at the back.
730645008,TOM SUPER FANCY,Swimwear bottom,Swimwear,Orange,Swim shorts in woven fabric with an elasticated, drawstring waist, side pockets and a welt back pocket with a hook and loop fastening. Mesh inner shorts.
730687001,SULIMA jkt,Hoodie,Garment Upper body,Black,Outdoor jacket in woven fabric with a double-layered hood, stand up collar and zip down the front. Padded front and back sections and fleece-lined raglan sleeves in sturdy jersey with ribbed panels. Inset jersey panels in the sides and zipped front pockets. Longer and gently rounded at the back. Partly lined.
730720001,ED Tiblisi trs,Trousers,Garment Lower body,Black,Trousers in woven fabric with a high paper bag waist, side pockets, detachable tie belt and tapered legs.
730869001,ANYA skimitten,Gloves,Accessories,Light Pink,Padded mittens in windproof, water-repellent functional fabric with sewn-on appliqués and a print at the top. Elasticated seam at the wrists, inner ribbing and a plastic hook-and-eye fastener to keep the mittens together. Thinsulate™ lining.
730946002,Billie high,T-shirt,Garment Upper body,White,Fitted jersey top with a wide neckline and short sleeves.
731028002,Chica,Dress,Garment Full body,Greenish Khaki,Dress in a crêpe weave with a V-neck, sewn-in wrapover at the top with a concealed hook-and-eye fastening, and a seam at the waist.
731046003,Andy Softbra,Bra,Underwear,Red,Soft, non-wired lace bra with lined cups that give the bust a natural shape and light support. Narrow, adjustable shoulder straps, a metal fastener at the front and an elasticated, lace-trimmed hem.
731119004,Flirty Miki stud pk,Earring,Accessories,Light Orange,Metal stud earrings in various sizes and designs. Size from 0.3 cm to 2 cm.
731425003,Mooncake,Blouse,Garment Upper body,White,Blouse in an airy weave with a V-neck, covered buttons at the top and short sleeves. Two elasticated seams and a decorative drawstring at the waist, and a flounced hem. Unlined.
731512002,LEGGINGS BELLE BASIC 79,Trousers,Garment Lower body,Dark Blue,Leggings in washed, stretch denim with an elasticated waist, fake front pockets and real back pockets.
731512005,LEGGINGS BELLE BASIC 79,Leggings/Tights,Garment Lower body,Dark Blue,Leggings in washed, stretch denim with an elasticated waist, fake front pockets and real back pockets.
731526004,JEGGINGS JOY,Trousers,Garment Lower body,Light Blue,Jeggings in soft, stretch denim with a high waist, zip fly and button and back pockets. Adjustable, elasticated waist in sizes 8-12Y.
731689002,Hiara blouse,Blouse,Garment Upper body,Light Turquoise,Blouse in a viscose weave with a collar, buttons down the front and ties at the hem. Gently dropped shoulders and long balloon sleeves with wide, buttoned cuffs.
732271002,BOBBO bag charm,Other accessories,Accessories,Light Grey,Handbag accessory with a metal chain and carabiner hook, and an imitation leather pendant in the shape of a backpack. The backpack has a zip at the top, faux fur pompom and small, zipped outer compartment. Size approx. 3x7x9 cm.
732316002,Lori skirt,Skirt,Garment Lower body,Light Blue,Skirt in a viscose weave with a smocked waist and broderie anglaise at the hem. Unlined.
732371001,Filippa linnen (7),Trousers,Garment Lower body,Beige,Trousers in a linen and viscose weave with a high waist, detachable tie belt, zip fly and concealed hook-and-eye fasteners. Side pockets and straight, wide, ankle-length legs.
732409044,Beetle beanie new,Hat/beanie,Accessories,Light Green,Double-layered hat in a soft rib knit with a sewn-in turn-up at the hem with a small fabric appliqué on the front.
732409066,Beetle beanie new,Hat/beanie,Accessories,Yellow,Double-layered hat in a soft rib knit with a sewn-in turn-up at the hem with a small fabric appliqué on the front.
732413002,PANORAMA sports bra,Bra,Underwear,Dark Blue,Sports bra in fast-drying functional fabric with a V-neck and padded cups with removable inserts. Narrow, adjustable shoulder straps, a mesh racer back and elastication at the hem. Medium support.
732423001,CNY Nike knitted top,Sweater,Garment Upper body,Red,Fitted jumper in a rib-knit viscose blend with a collar, V-neck, long sleeves and raw edges at the cuffs and hem.
732460001,Heavy rib Concious 1p leggings,Leggings/Tights,Garment Lower body,Light Beige,Leggings in ribbed organic cotton with roll edges at the hems.
732573008,Durum Wrap Blouse,Blouse,Garment Upper body,White,Blouse in woven fabric with a collar and wrapover front with ties at the side. Long, slightly wider sleeves with narrow elastication at the cuffs.
732708001,Alba headband,Hair/alice band,Accessories,Orange,Fabric hairband with a knot detail at the front and covered elastic at the back.
732794001,Mac Sandal BB,Sandals,Shoes,Black,Sandals in scuba fabric with an adjustable foot strap and heel strap with hook and loop fastenings, and a loop at the back. Embossed ethylene-vinyl acetate (EVA) insoles and chunky thermoplastic rubber (TPR) soles.
732805002,KATE BLOUSE,Blouse,Garment Upper body,White,Blouse in a patterned viscose weave with a V-neck, covered buttons at the front and long balloon sleeves with narrow elastication at the cuffs.
732902001,Leo onesie SG,Dress,Garment Full body,Light Beige,Fancy dress costume in soft velour with a hood with embroidered appliqués. Zip down the front, front pockets, a detachable tail at the back and ribbing at the cuffs and hems.
733011002,EMMA PJ,Pyjama set,Nightwear,Dark Blue,Pyjamas in soft cotton jersey. Short-sleeved top with a print motif. Shorts with an elasticated waist.
733090001,Fav polo 3-pack,Polo shirt,Garment Upper body,White,Short-sleeved polo shirts in cotton piqué with a ribbed collar, button placket and short slits in the sides.
733248004,Thelma dress,Dress,Garment Full body,Dark Blue,Short, A-line dress in pleated jersey with a round neckline, small opening with a button at the back of the neck and long sleeves with wide, buttoned cuffs.
733323004,NEPTUNE MUSCLE OXFORD SHIRT,Shirt,Garment Upper body,Blue,Shirt in stretch Oxford cotton with a button-down collar, classic front and a yoke and darts at the back. Long sleeves with adjustable buttoning at the cuffs, and a rounded hem. Muscle Fit – a fit designed to showcase the body’s physique with narrow shoulders and tapered sleeves to create a flattering silhouette.
733323008,NEPTUNE MUSCLE OXFORD SHIRT,Shirt,Garment Upper body,Greenish Khaki,Shirt in stretch Oxford cotton with a button-down collar, classic front and a yoke and darts at the back. Long sleeves with adjustable buttoning at the cuffs, and a rounded hem. Muscle Fit – a fit designed to showcase the body’s physique with narrow shoulders and tapered sleeves to create a flattering silhouette.
733419005,Pearl Jam,Dress,Garment Full body,Dark Green,Knee-length dress in a crêpe weave with a V-neck, buttons down the front and short sleeves with a drawstring. Seam at the waist and a gently flared skirt. Unlined.
733549002,POPEYE SHIRT,Shirt,Garment Upper body,Black,Shirt in a soft weave with a collar, buttons down the front and 3/4-length sleeves with elastication and a flounce at the cuffs.
733575001,DIV Fiffi flare,Trousers,Garment Lower body,Black,Leggings in sturdy jersey with a slight sheen. Elasticated waist and flared legs.
733801002,Lovebird short,Shorts,Garment Lower body,Dark Blue,Short shorts in woven fabric with a slight sheen. High waist with an extended waist band and metal buttons, a zip fly, side pockets and legs with creases.
733814004,Molly dress,Dress,Garment Full body,Yellow,Short, fitted dress in soft cotton jersey with narrow shoulder straps.
733858002,SC HUDSON dress,Dress,Garment Full body,Beige,STUDIO COLLECTION. Shirt dress in linen and cotton twill with a stand-up collar and bib front with a button placket. Low dropped shoulders, wide sleeves with volume, and wide, buttoned cuffs. Gathers front and back for added volume, slightly twisted side seams and slits in the sides. Unlined.
733979001,SC COELHO knit jumper,Sweater,Garment Upper body,Orange,STUDIO COLLECTION. Short jumper in chunky, textured-knit cotton with a higher neckline, low dropped shoulders and extra-long sleeves. Ribbed section at the top that accentuates the shoulders and creates a boxy fit. Decorative, contrasting colour stitching around the neckline, at the shoulders and around the sleeves, cuffs and hem. Wide ribbing around the neckline, cuffs and hem.
734024004,SC DIEGO vest top,Top,Garment Upper body,Orange,STUDIO COLLECTION. Vest top in sturdy, ribbed jersey. Narrow cut at the top with a racer back, lacing at the sides and raw edges. Gently rounded hem.
734225001,Madonna set,Dungarees,Garment Full body,Light Grey,Set with a pair of dungaree shorts in woven fabric and a T-shirt in slub cotton jersey. Dungaree shorts with patch front pockets, straps with adjustable buttoning, and embroidery and appliqués on the front. Buttons at the sides and concealed press-studs at the crotch. T-shirt with a press-stud on one shoulder and short slits in the sides. Slightly longer at the back.
734287001,Fusili,Blouse,Garment Upper body,Black,Sleeveless blouse in a viscose crêpe weave with a V-neck, covered buttons down the front and a yoke with decorative gathers at the shoulders and back. Rounded hem, longer at the back.
734435004,Saskia Dress,Dress,Garment Full body,Red,Short dress in an airy weave with an opening at the top and small, pleated stand-up collar with ties at the front. Short, pleated cap sleeves and a narrow, elasticated seam at the waist. Lined.
734500001,Alba blouse tencel,Blouse,Garment Upper body,Light Blue,Blouse in soft, washed Tencel™ lyocell denim with a V-neck and decorative buttons down the front. Yoke at the back, short butterfly sleeves and a tie belt at the waist.
734540003,Brenda short,Shorts,Garment Lower body,Light Turquoise,Shorts in a cotton weave with an adjustable elasticated waist, zip fly and press-stud, side pockets, welt back pockets and sewn-in turn-ups at the hems.
734595001,MANDY RW biker,Shorts,Garment Lower body,Black,Knee-length cycling shorts in fast-drying functional fabric with a wide waistband containing a concealed key pocket.
734900001,Marketbag,Bag,Accessories,Light Orange,Shopper in sturdy plastic mesh with two metal handles and a reinforced, folding base. Size approx. 12x35x48 cm.
735026002,Mac Practical Sandal SB MC,Sandals,Shoes,Greenish Khaki,Sturdy mesh sandals with a hook and loop fastening at the top and a loop at the back. Scuba fabric lining. Textured insoles and thermoplastic rubber (TPR) soles.
735089003,Mason 3-p s/l pj SB,Pyjama set,Nightwear,Blue,Pyjamas in soft cotton jersey. T-shirt top with a ribbed trim around the neckline and short sleeves with ribbed trims. Shorts with an elasticated waist and narrow ribbing at the hems.
735229002,ES SADE TWILL JKT,Jacket,Garment Upper body,White,Biker jacket in slightly stretchy twill made from a cotton blend. Notch lapels with a decorative metal button, a diagonal zip down the front, zipped front pockets and a decorative tab and metal press-stud at the sides. Lined.
735328002,Stardust,Dress,Garment Full body,Light Grey,Long-sleeved dress in soft cotton jersey with a reversible sequin motif on the front (size 1½-3Y with normal sequins), seam at the waist and flared skirt.
735346001,Dave Fancy BB,Flip flop,Shoes,Dark Blue,Pool shoes with a wide fabric hook and loop tab with two fasteners. Soft soles with a fluted underside.
735532001,EDC Anki Top,Blouse,Garment Upper body,Light Beige,Short, off-the-shoulder top in airy crinkled chiffon made partly from recycled polyester. Elastication and a wide flounce at the top and narrow ties that fasten at the back of the neck. Short sleeves with a narrow elasticated seam, and a smocked hem. Unlined.
735583001,PIGALLE tights,Leggings/Tights,Garment Lower body,Black,Sports tights in fast-drying functional fabric with wide ribbing to hold in and shape the waist. Concealed key pocket in the waistband and ventilating mesh sections down the sides. The polyester content of the tights is recycled.
735623005,Noven Shelltop,Blouse,Garment Upper body,Greenish Khaki,Blouse in woven fabric with a stand-up collar with gathers at the front and an opening with covered buttons at the back of the neck. Long sleeves and wide cuffs with a slit.
735751002,Milan Fringe,Jacket,Garment Upper body,Black,Long-sleeved cardigan in a fine knit with fringing. No fasteners.
735840020,Bridget Sweater,Sweater,Garment Upper body,White,Jumper in a soft rib knit containing some wool with dropped shoulders, long sleeves and ribbing around the neckline, cuffs and hem.
735870001,MANDY biker,Shorts,Garment Lower body,Black,Knee-length cycling shorts in fast-drying functional fabric with a wide waistband containing a concealed key pocket.
736010001,Cool Paulina earring,Earring,Accessories,White,Metal earrings with plastic beads. Length 7 cm.
736046002,Cool Mia hoop pk,Earring,Accessories,Silver,Metal hoop earrings in different sizes, three with charms in various designs. Diameter 1-2 cm.
736066005,Cornelia softbra,Bra,Underwear,Light Blue,Soft, non-wired bra in lace with mesh-lined cups that give the bust a natural shape and provide light support. Adjustable shoulder straps and no fasteners.
736087001,Flirty Charm hoop pk,Earring,Accessories,Gold,Metal hoop earrings in various sizes with pendants in various designs. Diameter 2 cm and 1.5 cm.
736092001,Cool Vanessa necklace,Necklace,Accessories,Gold,Multi-strand necklace in metal with chains in various designs and decorative coin pendants. Adjustable length approx. 37-46 cm.
736515002,Royale,Skirt,Garment Lower body,Dark Red,Knee-length skirt in a crêpe weave with a high, gathered waist, pockets in the side seams, a concealed zip in the side and lace at the hem. Lined.
736601001,Formentera padded Swimsuite,Swimsuit,Swimwear,Red,Fully lined swimsuit with frills at the top, a deep V-neck front and back, and padded cups with removable inserts.
736672002,Embrace Shorts,Shorts,Garment Lower body,Other,Short 5-pocket shorts in washed denim with worn details and a smart stretch function so that the shorts embrace the body for a comfortable and flattering fit. High waist, zip fly and skinny legs.
736691001,Love Affair Wide Side Tanga,Swimwear bottom,Swimwear,Dark Blue,Fully lined bikini bottoms with a low waist with wide elastication. Wide sides and cutaway coverage at the back.
737023001,TAMMI body TVP 3PACK,Bodysuit,Garment Upper body,Light Beige,Baby Exclusive. Sleeveless bodysuits in soft organic cotton jersey with narrow shoulder straps and press-studs at the crotch.
737311008,Paul LS Bandcollar,Shirt,Garment Upper body,Dark Blue,Shirt woven in a cotton blend with a grandad collar, classic front and yoke with a pleat and hanger at the back. Long sleeves with adjustable buttoning at the cuffs, and a rounded hem. Slightly longer at the back. Regular Fit – a classic fit with good room for movement and a gently tapered waist to create a comfortable, tailored silhouette.
737486004,Phoebe Cardigan SPEED,Cardigan,Garment Upper body,Yellow,Cardigan in a soft, loose knit with dropped shoulders, long sleeves and buttons down the front.
737617001,CE Citrine dress,Dress,Garment Full body,Beige,CONSCIOUS EXCLUSIVE. Short dress in a Tencel™ lyocell and silk blend containing glittery threads with a V-neck and narrow shoulder straps. Narrow ties and a rounded, gathered seam at the back, and a concealed zip in one side. Asymmetric seam with a small frill under the bust and a softly draping skirt with a wide flounce at the hem. Recycled polyester lining.
738077002,Cool September Earring OL,Earring,Accessories,Light Yellow,Metal earrings with round pendants in marbled plastic. Length 8 cm.
738093002,Anita,Sweater,Garment Upper body,Off White,Jumper in a soft, ribbed chunky knit with a V-neck, buttons down the front and shoulder straps. Finer ribbing around the neckline and hem and short slits in the sides. The polyester content of the top is recycled.
738095001,Cool Antoinette Necklace,Necklace,Accessories,Gold,Short metal necklace with an embossed pattern. Adjustable length 40-47 cm.
738184001,SKINNY LINED,Trousers,Garment Lower body,Dark Blue,Fully-lined, 5-pocket, slim-fit jeans in washed, stretch denim with an adjustable, elasticated waist, zip fly and button, and narrow hems.
738472001,PE ATHENA  LEATHER,Skirt,Garment Lower body,Dark Orange,Calf-length, A-line, wrapover skirt in soft leather with metal press-stud fastenings. Visible seam at the back, an opening at the front and raw edges. Lined at the top.
738483001,PE EZY DRESS,Dress,Garment Full body,Light Orange,Long dress in an airy, crinkled cotton and silk weave with a V-shaped opening with ties at the top and long, voluminous raglan sleeves with a small opening and covered button at the cuffs. Seam at the waist with a drawstring that can be pulled from the sides, and a large flounce at the front that continues down the sides for added width. Flared, softly draping skirt with high slits in the sides. Unlined.
738561002,Lola Top,Top,Garment Upper body,Off White,Sleeveless top in a soft, fine-knit viscose blend with a slightly wider neckline, dropped shoulders and appliqués in an embroidered weave at the sides.
738590004,Selma Plisse Skirt,Skirt,Garment Lower body,Pink,Calf-length skirt in softly draping, pleated satin with a visible, elasticated, ribbed waistband. Lined.
738612001,SNOOD JERSEY OWN.,Scarf,Accessories,Blue,Double-layered tube scarf in soft cotton jersey.
738706002,SUPREME fancy tights,Trousers,Garment Lower body,Light Green,Sports tights in fast-drying functional fabric with a waist panel.
738711002,KATE tee,T-shirt,Garment Upper body,Other Pink,Sports top in fast-drying functional fabric with twisted side seams and short raglan sleeves.
738815004,TIKI yoga sock,Socks,Socks & Tights,Dark Green,Yoga socks with elastic straps that cross over the feet and anti-slip protectors on the soles.
738899005,Banoffe,Dress,Garment Full body,White,Calf-length dress in a cotton and viscose weave with embroidery and inset lace trims. Scalloped V-neck, narrow, adjustable shoulder straps, seam with a lace trim at the waist and a concealed zip at the back. Lined.
738921002,Class Carol hoop pk RT,Earring,Accessories,Silver,Thin metal hoop earrings with coin-shaped pendants. Diameter 2 cm.
739090001,SC - OLSON scarf,Scarf,Accessories,Dark Yellow,STUDIO COLLECTION. Scarf in a soft, airy, patterned weave.
739092007,TP JACK hood SB,Hoodie,Garment Upper body,Dark Grey,Zip-through hoodie in sweatshirt fabric made from an organic cotton and recycled polyester blend with a soft brushed inside. Jersey-lined hood, a zip down the front, front pockets and ribbing at the cuffs and hem.
739362008,Evie padded softbra 2p,Bra,Underwear,Dark Blue,Soft, non-wired bras in lace with narrow, adjustable shoulder straps, removable inserts that shape the bust and provide good support, and a lace trim at the hem. No fasteners.
739529003,Bianca linen,T-shirt,Garment Upper body,Dark Blue,T-shirt in slub linen jersey with a round neckline, short sleeves and straight-cut hem.
739533003,&Denim Embrace HW Trash,Trousers,Garment Lower body,Dark Blue,5-pocket, ankle-length jeans in washed, stretch denim with hard-worn details, a high waist, zip fly and button and skinny legs with raw-edge hems. Embrace – denim with a smart stretch function that moulds to the body for a comfortable, flattering silhouette.
739611002,Bass Fake Crochet Tee,Vest top,Garment Upper body,White,Short top in a cotton knit with ties at the back of the neck and a scalloped edge at the top and hem.
739679006,Beck LS Top,Top,Garment Upper body,White,Long-sleeved top in soft cotton jersey with a sequin motif on the front and a rounded hem. Slightly longer at the back.
739680024,Mia L/S Tee,Top,Garment Upper body,White,Long-sleeved top in soft cotton jersey with a round neck. Slightly longer at the back.
739684005,James leggings,Leggings/Tights,Garment Lower body,White,Leggings in soft cotton jersey with an elasticated waist.
739802019,LEGGINGS FANCY,Leggings/Tights,Garment Lower body,Blue,Leggings in washed, stretch denim with an elasticated waist, fake fly and back pockets.
739810001,Urban leggings 2-p,Trousers,Garment Lower body,Green,Trousers in soft slub cotton jersey with an elasticated drawstring waist and ribbed hems.
739833012,SIMPSONS HOOD TP,Hoodie,Garment Upper body,Dark Blue,Top in soft sweatshirt fabric with a wrapover hood, print motif on the front and ribbing at the cuffs and hem. Soft brushed inside.
739889005,BADGER FANCY,Sweater,Garment Upper body,Red,Jumper in soft, fine-knit cotton with a sequined motif on the front, a round, ribbed neckline, long sleeves and slits in the sides. Slightly longer at the back.
739901011,YSTAD,Sweater,Garment Upper body,Off White,Jumper in a soft knit with a fluffy finish. Motif on the front, long sleeves and slits in the sides. Slightly longer at the back.
739922002,AMY beanie LATE,Hat/beanie,Accessories,Grey,Hat in a soft rib knit containing glittery threads with a decorative bow at the hem.
739953001,Lennox,Blouse,Garment Upper body,White,V-neck blouse in an airy weave with a slight sheen and velvety-smooth finish. Stand-up collar, long sleeves, wide cuffs with covered buttons, a yoke with a pleat at the back, and a rounded hem. Slightly longer at the back.
739953003,Lennox,Blouse,Garment Upper body,Dark Red,V-neck blouse in an airy weave with a slight sheen and velvety-smooth finish. Stand-up collar, long sleeves, wide cuffs with covered buttons, a yoke with a pleat at the back, and a rounded hem. Slightly longer at the back.
740500001,LOLA hunterglove,Gloves,Accessories,Dark Grey,Fine-knit mittens decorated with plastic beads. Flap at the front that can be fastened back with a button to reveal a pair of fingerless gloves.
740588004,Tess Sl-set DTP (W),Pyjama set,Nightwear,Dark Blue,Pyjamas with a strappy top and shorts in a soft viscose weave. Top with narrow shoulder straps and a wide flounce at the hem. Shorts with narrow elastication at the waist and a frill trim at the hem.
740700002,Flirty Sassa earring,Earring,Accessories,Dark Orange,Round plastic earrings with hoop-shaped pendants. Length 4.5 cm.
740725001,Harry Push Bra,Bikini top,Swimwear,Light Orange,Bikini top with underwired, moulded, padded cups for a larger bust and fuller cleavage. Ties at the back of the neck.
